Section,Url,Content,Metadata
227. —Front Matter,https://uscode.house.gov/view.xhtml?req=granuleid:USC-prelim-title18-chapter227-front&num=0&edition=prelim,"18 USC Ch. 227: Front Matter            Result 1 of 1                                      Current2018 Ed. and Supplement V (1/3/2024)2018 Ed. and Supplement IV (1/5/2023)2018 Ed. and Supplement III (1/3/2022)2018 Ed. and Supplement II (1/13/2021)2018 Ed. and Supplement I (1/24/2020)2018 Main Ed. (1/14/2019)2012 Ed. and Supplement V (1/12/2018)2012 Ed. and Supplement IV (1/6/2017)2012 Ed. and Supplement III (1/3/2016)2012 Ed. and Supplement II (1/5/2015)2012 Ed. and Supplement I (1/16/2014)2012 Main Ed. (1/15/2013)2006 Ed. and Supplement V (1/3/2012)2006 Ed. and Supplement IV (1/7/2011)2006 Ed. and Supplement III (2/1/2010)2006 Ed. and Supplement II (1/5/2009)2006 Ed. and Supplement I (1/8/2008)2006 Main Ed. (1/3/2007)2000 Ed. and Supplement V (1/2/2006)2000 Ed. and Supplement IV (1/3/2005)2000 Ed. and Supplement III (1/19/2004)2000 Ed. and Supplement II (1/6/2003)2000 Ed. and Supplement I (1/22/2002)2000 Main Ed. (1/2/2001)1994 Ed. and Supplement V (1/23/2000)1994 Ed. and Supplement IV (1/5/1999)1994 Ed. and Supplement III (1/26/1998)1994 Ed. and Supplement II (1/6/1997)1994 Ed. and Supplement I (1/16/1996)1994 Main Ed. (1/4/1995)                         Back to Original Document << Previous                                 TITLE 18 / PART II / CHAPTER 227 / Front Matter                                 Next >>[Print]                                  [Print selection][OLRC Home]Help 18 USC Ch. 227: Front MatterFrom Title 18-CRIMES AND CRIMINAL PROCEDUREPART II-CRIMINAL PROCEDURECHAPTER 227-SENTENCESJump To: MiscellaneousPrior ProvisionsCHAPTER 227-SENTENCESSubchapterSec.1        A.General Provisions3551B.Probation3561C.Fines3571D.Imprisonment3581        Editorial NotesPrior ProvisionsA prior chapter 227 (§3561 et seq.) was repealed (except sections 3577 to 3580 which were renumbered sections 3661 to 3664, respectively), by Pub. L. 98–473, title II, §§212(a)(1), (2), 235(a)(1), Oct. 12, 1984, 98 Stat. 1987, 2031, as amended, effective Nov. 1, 1987, and applicable only to offenses committed after the taking effect of such repeal. See Effective Date note set out under section 3551 of this title.Section 3561, act June 25, 1948, ch. 645, 62 Stat. 837, related to judgment form and entry-(Rule).Section 3562, act June 25, 1948, ch. 645, 62 Stat. 837, related to sentence-(Rule).Section 3563, act June 25, 1948, ch. 645, 62 Stat. 837, related to corruption of blood or forfeiture of estate.Section 3564, act June 25, 1948, ch. 645, 62 Stat. 837, related to pillory and whipping.Section 3565, acts June 25, 1948, ch. 645, 62 Stat. 837; Oct. 12, 1984, Pub. L. 98–473, title II, §§235(a)(1), 238(g)(1), (i), 98 Stat. 2031, 2039; Oct. 30, 1984, Pub. L. 98–596, §§2, 12(a)(7)(A), (9), (b), 98 Stat. 3134, 3139, 3140; Oct. 22, 1986, Pub. L. 99–514, §2, 100 Stat. 2095, related to collection and payment of fines and penalties.Section 3566, act June 25, 1948, ch. 645, 62 Stat. 837, related to execution of death sentence.Section 3567, act June 25, 1948, ch. 645, 62 Stat. 838, related to death sentence may prescribe dissection.Section 3568, acts June 25, 1948, ch. 645, 62 Stat. 838; Sept. 2, 1960, Pub. L. 86–691, §1(a), 74 Stat. 738; June 22, 1966, Pub. L. 89–465, §4, 80 Stat. 217, related to effective date of sentence and credit for time in custody prior to the imposition of sentence.Section 3569, acts June 25, 1948, ch. 645, 62 Stat. 838; Oct. 17, 1968, Pub. L. 90–578, title III, §301(a)(1), (3), 82 Stat. 1115; Oct. 12, 1984, Pub. L. 98–473, title II, §§235(a)(1), 238(h), (i), 98 Stat. 2031, 2039; Oct. 30, 1984, Pub. L. 98–596, §§3, 12(a)(8), (9), (b), 98 Stat. 3136, 3139, 3140, related to discharge of indigent prisoner.Section 3570, act June 25, 1948, ch. 645, 62 Stat. 839, related to presidential remission as affecting unremitted part.Section 3571, act June 25, 1948, ch. 645, 62 Stat. 839, related to clerical mistakes-(Rule).Section 3572, act June 25, 1948, ch. 645, 62 Stat. 839, related to correction or reduction of sentence-(Rule).Section 3573, act June 25, 1948, ch. 645, 62 Stat. 839, related to arrest or setting aside of judgment-(Rule).Section 3574, act June 25, 1948, ch. 645, 62 Stat. 839, related to stay of execution and supersedeas-(Rule).Section 3575, added Pub. L. 91–452, title X, §1001(a), Oct. 15, 1970, 84 Stat. 948, related to increased sentence for dangerous special offenders.Section 3576, added Pub. L. 91–452, title X, §1001(a), Oct. 15, 1970, 84 Stat. 950, related to review of sentence.Section 3577 renumbered section 3661 of this title.Section 3578 renumbered section 3662 of this title.Section 3579 renumbered section 3663 of this title.Section 3580 renumbered section 3664 of this title.1 Editorially supplied.","Prior ProvisionsA prior chapter 227 (§3561 et seq.) was repealed (except sections 3577 to 3580 which were renumbered sections 3661 to 3664, respectively), by Pub. L. 98–473, title II, §§212(a)(1), (2), 235(a)(1), Oct. 12, 1984, 98 Stat. 1987, 2031, as amended, effective Nov. 1, 1987, and applicable only to offenses committed after the taking effect of such repeal. See Effective Date note set out under section 3551 of this title.Section 3561, act June 25, 1948, ch. 645, 62 Stat. 837, related to judgment form and entry-(Rule).Section 3562, act June 25, 1948, ch. 645, 62 Stat. 837, related to sentence-(Rule).Section 3563, act June 25, 1948, ch. 645, 62 Stat. 837, related to corruption of blood or forfeiture of estate.Section 3564, act June 25, 1948, ch. 645, 62 Stat. 837, related to pillory and whipping.Section 3565, acts June 25, 1948, ch. 645, 62 Stat. 837; Oct. 12, 1984, Pub. L. 98–473, title II, §§235(a)(1), 238(g)(1), (i), 98 Stat. 2031, 2039; Oct. 30, 1984, Pub. L. 98–596, §§2, 12(a)(7)(A), (9), (b), 98 Stat. 3134, 3139, 3140; Oct. 22, 1986, Pub. L. 99–514, §2, 100 Stat. 2095, related to collection and payment of fines and penalties.Section 3566, act June 25, 1948, ch. 645, 62 Stat. 837, related to execution of death sentence.Section 3567, act June 25, 1948, ch. 645, 62 Stat. 838, related to death sentence may prescribe dissection.Section 3568, acts June 25, 1948, ch. 645, 62 Stat. 838; Sept. 2, 1960, Pub. L. 86–691, §1(a), 74 Stat. 738; June 22, 1966, Pub. L. 89–465, §4, 80 Stat. 217, related to effective date of sentence and credit for time in custody prior to the imposition of sentence.Section 3569, acts June 25, 1948, ch. 645, 62 Stat. 838; Oct. 17, 1968, Pub. L. 90–578, title III, §301(a)(1), (3), 82 Stat. 1115; Oct. 12, 1984, Pub. L. 98–473, title II, §§235(a)(1), 238(h), (i), 98 Stat. 2031, 2039; Oct. 30, 1984, Pub. L. 98–596, §§3, 12(a)(8), (9), (b), 98 Stat. 3136, 3139, 3140, related to discharge of indigent prisoner.Section 3570, act June 25, 1948, ch. 645, 62 Stat. 839, related to presidential remission as affecting unremitted part.Section 3571, act June 25, 1948, ch. 645, 62 Stat. 839, related to clerical mistakes-(Rule).Section 3572, act June 25, 1948, ch. 645, 62 Stat. 839, related to correction or reduction of sentence-(Rule).Section 3573, act June 25, 1948, ch. 645, 62 Stat. 839, related to arrest or setting aside of judgment-(Rule).Section 3574, act June 25, 1948, ch. 645, 62 Stat. 839, related to stay of execution and supersedeas-(Rule).Section 3575, added Pub. L. 91–452, title X, §1001(a), Oct. 15, 1970, 84 Stat. 948, related to increased sentence for dangerous special offenders.Section 3576, added Pub. L. 91–452, title X, §1001(a), Oct. 15, 1970, 84 Stat. 950, related to review of sentence.Section 3577 renumbered section 3661 of this title.Section 3578 renumbered section 3662 of this title.Section 3579 renumbered section 3663 of this title.Section 3580 renumbered section 3664 of this title.1 Editorially supplied."
SUBCHAPTER A—Front Matter,https://uscode.house.gov/view.xhtml?req=granuleid:USC-prelim-title18-chapter227-subchapterA-front&num=0&edition=prelim,"18 USC PART II, CHAPTER 227, SUBCHAPTER A: Front Matter            Result 1 of 1                                      Current2018 Ed. and Supplement V (1/3/2024)2018 Ed. and Supplement IV (1/5/2023)2018 Ed. and Supplement III (1/3/2022)2018 Ed. and Supplement II (1/13/2021)2018 Ed. and Supplement I (1/24/2020)2018 Main Ed. (1/14/2019)2012 Ed. and Supplement V (1/12/2018)2012 Ed. and Supplement IV (1/6/2017)2012 Ed. and Supplement III (1/3/2016)2012 Ed. and Supplement II (1/5/2015)2012 Ed. and Supplement I (1/16/2014)2012 Main Ed. (1/15/2013)2006 Ed. and Supplement V (1/3/2012)2006 Ed. and Supplement IV (1/7/2011)2006 Ed. and Supplement III (2/1/2010)2006 Ed. and Supplement II (1/5/2009)2006 Ed. and Supplement I (1/8/2008)2006 Main Ed. (1/3/2007)2000 Ed. and Supplement V (1/2/2006)2000 Ed. and Supplement IV (1/3/2005)2000 Ed. and Supplement III (1/19/2004)2000 Ed. and Supplement II (1/6/2003)2000 Ed. and Supplement I (1/22/2002)2000 Main Ed. (1/2/2001)1994 Ed. and Supplement V (1/23/2000)1994 Ed. and Supplement IV (1/5/1999)1994 Ed. and Supplement III (1/26/1998)1994 Ed. and Supplement II (1/6/1997)1994 Ed. and Supplement I (1/16/1996)1994 Main Ed. (1/4/1995)                         Back to Original Document << Previous                                 TITLE 18 / PART II / CHAPTER 227 / SUBCHAPTER A / Front Matter                                 Next >>[Print]                                  [Print selection][OLRC Home]Help 18 USC PART II, CHAPTER 227, SUBCHAPTER A: Front MatterFrom Title 18-CRIMES AND CRIMINAL PROCEDUREPART II-CRIMINAL PROCEDURECHAPTER 227-SENTENCESSUBCHAPTER A-GENERAL PROVISIONSJump To: MiscellaneousAmendmentsSUBCHAPTER A-GENERAL PROVISIONSSUBCHAPTER A-GENERAL PROVISIONS 1Sec.3551.Authorized sentences.3552.Presentence reports.3553.Imposition of a sentence.3554.Order of criminal forfeiture.3555.Order of notice to victims.3556.Order of restitution.3557.Review of a sentence.3558.Implementation of a sentence.3559.Sentencing classification of offenses.        Editorial NotesAmendments1994-Pub. L. 103–322, title XXXIII, §330010(3), Sept. 13, 1994, 108 Stat. 2143, transferred analysis for this subchapter to follow heading of this subchapter.1 So in original. Probably should not appear.","Amendments1994-Pub. L. 103–322, title XXXIII, §330010(3), Sept. 13, 1994, 108 Stat. 2143, transferred analysis for this subchapter to follow heading of this subchapter.1 So in original. Probably should not appear."
3552. Presentence reports,https://uscode.house.gov/view.xhtml?req=granuleid:USC-prelim-title18-section3552&num=0&edition=prelim,"(a) Presentence Investigation and Report by Probation Officer.-A United States probation officer shall make a presentence investigation of a defendant that is required pursuant to the provisions of Rule 32(c) of the Federal Rules of Criminal Procedure, and shall, before the imposition of sentence, report the results of the investigation to the court.(b) Presentence Study and Report by Bureau of Prisons.-If the court, before or after its receipt of a report specified in subsection (a) or (c), desires more information than is otherwise available to it as a basis for determining the sentence to be imposed on a defendant found guilty of a misdemeanor or felony, it may order a study of the defendant. The study shall be conducted in the local community by qualified consultants unless the sentencing judge finds that there is a compelling reason for the study to be done by the Bureau of Prisons or there are no adequate professional resources available in the local community to perform the study. The period of the study shall be no more than sixty days. The order shall specify the additional information that the court needs before determining the sentence to be imposed. Such an order shall be treated for administrative purposes as a provisional sentence of imprisonment for the maximum term authorized by section 3581(b) for the offense committed. The study shall inquire into such matters as are specified by the court and any other matters that the Bureau of Prisons or the professional consultants believe are pertinent to the factors set forth in section 3553(a). The period of the study may, in the discretion of the court, be extended for an additional period of not more than sixty days. By the expiration of the period of the study, or by the expiration of any extension granted by the court, the United States marshal shall, if the defendant is in custody, return the defendant to the court for final sentencing. The Bureau of Prisons or the professional consultants shall provide the court with a written report of the pertinent results of the study and make to the court whatever recommendations the Bureau or the consultants believe will be helpful to a proper resolution of the case. The report shall include recommendations of the Bureau or the consultants concerning the guidelines and policy statements, promulgated by the Sentencing Commission pursuant to 28 U.S.C. 994(a), that they believe are applicable to the defendant's case. After receiving the report and the recommendations, the court shall proceed finally to sentence the defendant in accordance with the sentencing alternatives and procedures available under this chapter.(c) Presentence Examination and Report by Psychiatric or Psychological Examiners.-If the court, before or after its receipt of a report specified in subsection (a) or (b) desires more information than is otherwise available to it as a basis for determining the mental condition of the defendant, the court may order the same psychiatric or psychological examination and report thereon as may be ordered under section 4244(b) of this title.(d) Disclosure of Presentence Reports.-The court shall assure that a report filed pursuant to this section is disclosed to the defendant, the counsel for the defendant, and the attorney for the Government at least ten days prior to the date set for sentencing, unless this minimum period is waived by the defendant. The court shall provide a copy of the presentence report to the attorney for the Government to use in collecting an assessment, criminal fine, forfeiture or restitution imposed.(Added Pub. L. 98–473, title II, §212(a)(2), Oct. 12, 1984, 98 Stat. 1988; amended Pub. L. 99–646, §7(a), Nov. 10, 1986, 100 Stat. 3593; Pub. L. 101–647, title XXXVI, §3625, Nov. 29, 1990, 104 Stat. 4965.)Editorial NotesAmendments1990-Subsec. (d). Pub. L. 101–647 inserted at end ""The court shall provide a copy of the presentence report to the attorney for the Government to use in collecting an assessment, criminal fine, forfeiture or restitution imposed.""1986-Subsec. (b). Pub. L. 99–646, §7(a)(1), (2), substituted ""study shall be"" for ""study shall take"" and inserted "", if the defendant is in custody,"" after ""United States marshal shall"".Subsec. (c). Pub. L. 99–646, §7(a)(3), substituted ""the court may order the same psychiatric or psychological examination and report thereon as may be ordered under section 4244(b) of this title"" for ""it may order that the defendant undergo a psychiatric or psychological examination and that the court be provided with a written report of the results of the examination pursuant to the provisions of section 4247"".Statutory Notes and Related SubsidiariesEffective Date of 1990 AmendmentAmendment by Pub. L. 101–647 effective 180 days after Nov. 29, 1990, see section 3631 of Pub. L. 101–647, set out as an Effective Date note under section 3001 of Title 28, Judiciary and Judicial Procedure.Effective Date of 1986 AmendmentPub. L. 99–646, §7(b), Nov. 10, 1986, 100 Stat. 3593, provided that: ""The amendments made by this section [amending this section] shall take effect on the date of the taking effect of section 3552 of title 18, United States Code [Nov. 1, 1987].""Effective DateSection effective Nov. 1, 1987, and applicable only to offenses committed after the taking effect of this section, see section 235(a)(1) of Pub. L. 98–473, set out as a note under section 3551 of this title.Use of Certain Technology To Facilitate Criminal ConductPub. L. 104–294, title V, §501, Oct. 11, 1996, 110 Stat. 3497, provided that:""(a) Information.-The Administrative Office of the United States courts shall establish policies and procedures for the inclusion in all presentence reports of information that specifically identifies and describes any use of encryption or scrambling technology that would be relevant to an enhancement under section 3C1.1 (dealing with Obstructing or Impeding the Administration of Justice) of the Sentencing Guidelines or to offense conduct under the Sentencing Guidelines.""(b) Compiling and Report.-The United States Sentencing Commission shall-""(1) compile and analyze any information contained in documentation described in subsection (a) relating to the use of encryption or scrambling technology to facilitate or conceal criminal conduct; and""(2) based on the information compiled and analyzed under paragraph (1), annually report to the Congress on the nature and extent of the use of encryption or scrambling technology to facilitate or conceal criminal conduct.""","Amendments1990-Subsec. (d). Pub. L. 101–647 inserted at end ""The court shall provide a copy of the presentence report to the attorney for the Government to use in collecting an assessment, criminal fine, forfeiture or restitution imposed.""1986-Subsec. (b). Pub. L. 99–646, §7(a)(1), (2), substituted ""study shall be"" for ""study shall take"" and inserted "", if the defendant is in custody,"" after ""United States marshal shall"".Subsec. (c). Pub. L. 99–646, §7(a)(3), substituted ""the court may order the same psychiatric or psychological examination and report thereon as may be ordered under section 4244(b) of this title"" for ""it may order that the defendant undergo a psychiatric or psychological examination and that the court be provided with a written report of the results of the examination pursuant to the provisions of section 4247"".Statutory Notes and Related SubsidiariesEffective Date of 1990 AmendmentAmendment by Pub. L. 101–647 effective 180 days after Nov. 29, 1990, see section 3631 of Pub. L. 101–647, set out as an Effective Date note under section 3001 of Title 28, Judiciary and Judicial Procedure.Effective Date of 1986 AmendmentPub. L. 99–646, §7(b), Nov. 10, 1986, 100 Stat. 3593, provided that: ""The amendments made by this section [amending this section] shall take effect on the date of the taking effect of section 3552 of title 18, United States Code [Nov. 1, 1987].""Effective DateSection effective Nov. 1, 1987, and applicable only to offenses committed after the taking effect of this section, see section 235(a)(1) of Pub. L. 98–473, set out as a note under section 3551 of this title.Use of Certain Technology To Facilitate Criminal ConductPub. L. 104–294, title V, §501, Oct. 11, 1996, 110 Stat. 3497, provided that:""(a) Information.-The Administrative Office of the United States courts shall establish policies and procedures for the inclusion in all presentence reports of information that specifically identifies and describes any use of encryption or scrambling technology that would be relevant to an enhancement under section 3C1.1 (dealing with Obstructing or Impeding the Administration of Justice) of the Sentencing Guidelines or to offense conduct under the Sentencing Guidelines.""(b) Compiling and Report.-The United States Sentencing Commission shall-""(1) compile and analyze any information contained in documentation described in subsection (a) relating to the use of encryption or scrambling technology to facilitate or conceal criminal conduct; and""(2) based on the information compiled and analyzed under paragraph (1), annually report to the Congress on the nature and extent of the use of encryption or scrambling technology to facilitate or conceal criminal conduct."""
