Section,Url,Content,Metadata
229. —Front Matter,https://uscode.house.gov/view.xhtml?req=granuleid:USC-prelim-title18-chapter229-front&num=0&edition=prelim,"18 USC Ch. 229: Front Matter            Result 1 of 1                                      Current2018 Ed. and Supplement V (1/3/2024)2018 Ed. and Supplement IV (1/5/2023)2018 Ed. and Supplement III (1/3/2022)2018 Ed. and Supplement II (1/13/2021)2018 Ed. and Supplement I (1/24/2020)2018 Main Ed. (1/14/2019)2012 Ed. and Supplement V (1/12/2018)2012 Ed. and Supplement IV (1/6/2017)2012 Ed. and Supplement III (1/3/2016)2012 Ed. and Supplement II (1/5/2015)2012 Ed. and Supplement I (1/16/2014)2012 Main Ed. (1/15/2013)2006 Ed. and Supplement V (1/3/2012)2006 Ed. and Supplement IV (1/7/2011)2006 Ed. and Supplement III (2/1/2010)2006 Ed. and Supplement II (1/5/2009)2006 Ed. and Supplement I (1/8/2008)2006 Main Ed. (1/3/2007)2000 Ed. and Supplement V (1/2/2006)2000 Ed. and Supplement IV (1/3/2005)2000 Ed. and Supplement III (1/19/2004)2000 Ed. and Supplement II (1/6/2003)2000 Ed. and Supplement I (1/22/2002)2000 Main Ed. (1/2/2001)1994 Ed. and Supplement V (1/23/2000)1994 Ed. and Supplement IV (1/5/1999)1994 Ed. and Supplement III (1/26/1998)1994 Ed. and Supplement II (1/6/1997)1994 Ed. and Supplement I (1/16/1996)1994 Main Ed. (1/4/1995)                         Back to Original Document << Previous                                 TITLE 18 / PART II / CHAPTER 229 / Front Matter                                 Next >>[Print]                                  [Print selection][OLRC Home]Help 18 USC Ch. 229: Front MatterFrom Title 18-CRIMES AND CRIMINAL PROCEDUREPART II-CRIMINAL PROCEDURECHAPTER 229-POSTSENTENCE ADMINISTRATIONJump To: MiscellaneousPrior ProvisionsAmendmentsCHAPTER 229-POSTSENTENCE ADMINISTRATIONSubchapterSec.1        A.Probation3601B.Fines3611C.Imprisonment3621D.Risk and Needs Assessment 23631        Editorial NotesPrior ProvisionsA prior chapter 229 (§3611 et seq.) was repealed (except sections 3611, 3612, 3615, 3617 to 3620 which were renumbered sections 3665 to 3671, respectively), by Pub. L. 98–473, title II, §§212(a)(1), (2), 235(a)(1), Oct. 12, 1984, 98 Stat. 1987, 2031, as amended, effective Nov. 1, 1987, and applicable only to offenses committed after the taking effect of such repeal. See Effective Date note set out under section 3551 of this title.Section 3611 renumbered section 3665 of this title.Section 3612 renumbered section 3666 of this title.Section 3613, act June 25, 1948, ch. 645, 62 Stat. 840, related to fines for setting grass and timber fires.Section 3614, act June 25, 1948, ch. 645, 62 Stat. 840, related to fine for seduction.Section 3615 renumbered section 3667 of this title.Section 3616, act June 25, 1948, ch. 645, 62 Stat. 840, authorized use of confiscated vehicles by narcotics agents and payment of costs of acquisition, maintenance, repair, and operation thereof, prior to repeal by Pub. L. 91–513, title III, §1101(b)(2)(A), Oct. 27, 1970, 84 Stat. 1292.Section 3617 renumbered section 3668 of this title.Section 3618 renumbered section 3669 of this title.Section 3619 renumbered section 3670 of this title.Section 3620 renumbered section 3671 of this title.Section 3621, added Pub. L. 98–596, §6(a), Oct. 30, 1984, 98 Stat. 3136, related to criminal default on fine.Section 3622, added Pub. L. 98–596, §6(a), Oct. 30, 1984, 98 Stat. 3136, related to factors relating to imposition of fines.Section 3623, added Pub. L. 98–596, §6(a), Oct. 30, 1984, 98 Stat. 3137, related to alternative fines.Section 3624, added Pub. L. 98–596, §6(a), Oct. 30, 1984, 98 Stat. 3138, related to security for stayed fine.Amendments2018-Pub. L. 115–391, title I, §101(b), Dec. 21, 2018, 132 Stat. 5208, added item for subchapter D.1 Editorially supplied.2 So in original. Does not conform to subchapter heading.","Prior ProvisionsA prior chapter 229 (§3611 et seq.) was repealed (except sections 3611, 3612, 3615, 3617 to 3620 which were renumbered sections 3665 to 3671, respectively), by Pub. L. 98–473, title II, §§212(a)(1), (2), 235(a)(1), Oct. 12, 1984, 98 Stat. 1987, 2031, as amended, effective Nov. 1, 1987, and applicable only to offenses committed after the taking effect of such repeal. See Effective Date note set out under section 3551 of this title.Section 3611 renumbered section 3665 of this title.Section 3612 renumbered section 3666 of this title.Section 3613, act June 25, 1948, ch. 645, 62 Stat. 840, related to fines for setting grass and timber fires.Section 3614, act June 25, 1948, ch. 645, 62 Stat. 840, related to fine for seduction.Section 3615 renumbered section 3667 of this title.Section 3616, act June 25, 1948, ch. 645, 62 Stat. 840, authorized use of confiscated vehicles by narcotics agents and payment of costs of acquisition, maintenance, repair, and operation thereof, prior to repeal by Pub. L. 91–513, title III, §1101(b)(2)(A), Oct. 27, 1970, 84 Stat. 1292.Section 3617 renumbered section 3668 of this title.Section 3618 renumbered section 3669 of this title.Section 3619 renumbered section 3670 of this title.Section 3620 renumbered section 3671 of this title.Section 3621, added Pub. L. 98–596, §6(a), Oct. 30, 1984, 98 Stat. 3136, related to criminal default on fine.Section 3622, added Pub. L. 98–596, §6(a), Oct. 30, 1984, 98 Stat. 3136, related to factors relating to imposition of fines.Section 3623, added Pub. L. 98–596, §6(a), Oct. 30, 1984, 98 Stat. 3137, related to alternative fines.Section 3624, added Pub. L. 98–596, §6(a), Oct. 30, 1984, 98 Stat. 3138, related to security for stayed fine.Amendments2018-Pub. L. 115–391, title I, §101(b), Dec. 21, 2018, 132 Stat. 5208, added item for subchapter D.1 Editorially supplied.2 So in original. Does not conform to subchapter heading."
SUBCHAPTER A—Front Matter,https://uscode.house.gov/view.xhtml?req=granuleid:USC-prelim-title18-chapter229-subchapterA-front&num=0&edition=prelim,"18 USC PART II, CHAPTER 229, SUBCHAPTER A: Front Matter            Result 1 of 1                                      Current2018 Ed. and Supplement V (1/3/2024)2018 Ed. and Supplement IV (1/5/2023)2018 Ed. and Supplement III (1/3/2022)2018 Ed. and Supplement II (1/13/2021)2018 Ed. and Supplement I (1/24/2020)2018 Main Ed. (1/14/2019)2012 Ed. and Supplement V (1/12/2018)2012 Ed. and Supplement IV (1/6/2017)2012 Ed. and Supplement III (1/3/2016)2012 Ed. and Supplement II (1/5/2015)2012 Ed. and Supplement I (1/16/2014)2012 Main Ed. (1/15/2013)2006 Ed. and Supplement V (1/3/2012)2006 Ed. and Supplement IV (1/7/2011)2006 Ed. and Supplement III (2/1/2010)2006 Ed. and Supplement II (1/5/2009)2006 Ed. and Supplement I (1/8/2008)2006 Main Ed. (1/3/2007)2000 Ed. and Supplement V (1/2/2006)2000 Ed. and Supplement IV (1/3/2005)2000 Ed. and Supplement III (1/19/2004)2000 Ed. and Supplement II (1/6/2003)2000 Ed. and Supplement I (1/22/2002)2000 Main Ed. (1/2/2001)1994 Ed. and Supplement V (1/23/2000)1994 Ed. and Supplement IV (1/5/1999)1994 Ed. and Supplement III (1/26/1998)1994 Ed. and Supplement II (1/6/1997)1994 Ed. and Supplement I (1/16/1996)1994 Main Ed. (1/4/1995)                         Back to Original Document << Previous                                 TITLE 18 / PART II / CHAPTER 229 / SUBCHAPTER A / Front Matter                                 Next >>[Print]                                  [Print selection][OLRC Home]Help 18 USC PART II, CHAPTER 229, SUBCHAPTER A: Front MatterFrom Title 18-CRIMES AND CRIMINAL PROCEDUREPART II-CRIMINAL PROCEDURECHAPTER 229-POSTSENTENCE ADMINISTRATIONSUBCHAPTER A-PROBATIONJump To: MiscellaneousAmendmentsSUBCHAPTER A-PROBATIONSUBCHAPTER A-PROBATION 1Sec.3601.Supervision of probation.3602.Appointment of probation officers.3603.Duties of probation officers.3604.Transportation of a probationer.3605.Transfer of jurisdiction over a probationer.3606.Arrest and return of a probationer.3607.Special probation and expungement procedures for drug possessors.3608.Drug testing of Federal offenders on post-conviction release.        Editorial NotesAmendments1994-Pub. L. 103–322, title II, §20414(a)(2), title XXXIII, §330010(3), Sept. 13, 1994, 108 Stat. 1830, 2143, transferred analysis of this subchapter to follow heading for this subchapter and added item 3608.1990-Pub. L. 101–647, title XXXV, §3590, Nov. 29, 1990, 104 Stat. 4930, substituted ""possessors"" for ""possessor"" in item 3607.1 So in original. Probably should not appear.","Amendments1994-Pub. L. 103–322, title II, §20414(a)(2), title XXXIII, §330010(3), Sept. 13, 1994, 108 Stat. 1830, 2143, transferred analysis of this subchapter to follow heading for this subchapter and added item 3608.1990-Pub. L. 101–647, title XXXV, §3590, Nov. 29, 1990, 104 Stat. 4930, substituted ""possessors"" for ""possessor"" in item 3607.1 So in original. Probably should not appear."
3601. Supervision of probation,https://uscode.house.gov/view.xhtml?req=granuleid:USC-prelim-title18-section3601&num=0&edition=prelim,"A person who has been sentenced to probation pursuant to the provisions of subchapter B of chapter 227, or placed on probation pursuant to the provisions of chapter 403, or placed on supervised release pursuant to the provisions of section 3583, shall, during the term imposed, be supervised by a probation officer to the degree warranted by the conditions specified by the sentencing court.(Added Pub. L. 98–473, title II, §212(a)(2), Oct. 12, 1984, 98 Stat. 2001.)Statutory Notes and Related SubsidiariesEffective DateSection effective Nov. 1, 1987, and applicable only to offenses committed after the taking effect of this section, see section 235(a)(1) of Pub. L. 98–473, set out as a note under section 3551 of this title.Short Title of 1996 AmendmentPub. L. 104–134, title I, §101[(a)] [title VIII, §801], Apr. 26, 1996, 110 Stat. 1321, 1321-66; renumbered title I, Pub. L. 104–140, §1(a), May 2, 1996, 110 Stat. 1327, provided that: ""This title [enacting sections 1915A and 1932 of Title 28, Judiciary and Judicial Procedure, amending sections 3624 and 3626 of this title, section 523 of Title 11, Bankruptcy, sections 1346 and 1915 of Title 28, and sections 1997a to 1997c, 1997e, 1997f, and 1997h of Title 42, The Public Health and Welfare, enacting provisions set out as notes under section 3626 of this title, and repealing provisions set out as a note under section 3626 of this title] may be cited as the 'Prison Litigation Reform Act of 1995'.""Post Incarceration Vocational and Remedial Educational Opportunities for InmatesPub. L. 107–273, div. B, title II, §2411, Nov. 2, 2002, 116 Stat. 1799, provided that:""(a) Federal Reentry Center Demonstration.-""(1) Authority and establishment of demonstration project.-The Attorney General, in consultation with the Director of the Administrative Office of the United States Courts, shall establish the Federal Reentry Center Demonstration project. The project shall involve appropriate prisoners from the Federal prison population and shall utilize community corrections facilities, home confinement, and a coordinated response by Federal agencies to assist participating prisoners in preparing for and adjusting to reentry into the community.""(2) Project elements.-The project authorized by paragraph (1) shall include the following core elements:""(A) A Reentry Review Team for each prisoner, consisting of a representative from the Bureau of Prisons, the United States Probation System, the United States Parole Commission, and the relevant community corrections facility, who shall initially meet with the prisoner to develop a reentry plan tailored to the needs of the prisoner.""(B) A system of graduated levels of supervision with the community corrections facility to promote community safety, provide incentives for prisoners to complete the reentry plan, including victim restitution, and provide a reasonable method for imposing sanctions for a prisoner's violation of the conditions of participation in the project.""(C) Substance abuse treatment and aftercare, mental and medical health treatment and aftercare, vocational and educational training, life skills instruction, conflict resolution skills training, batterer intervention programs, assistance obtaining suitable affordable housing, and other programming to promote effective reintegration into the community as needed.""(3) Probation officers.-From funds made available to carry out this section, the Director of the Administrative Office of the United States Courts shall assign 1 or more probation officers from each participating judicial district to the Reentry Demonstration project. Such officers shall be assigned to and stationed at the community corrections facility and shall serve on the Reentry Review Teams.""(4) Project duration.-The Reentry Center Demonstration project shall begin not later than 6 months following the availability of funds to carry out this subsection, and shall last 3 years.""(b) Definitions.-In this section, the term 'appropriate prisoner' shall mean a person who is considered by prison authorities-""(1) to pose a medium to high risk of committing a criminal act upon reentering the community; and""(2) to lack the skills and family support network that facilitate successful reintegration into the community.""(c) Authorization of Appropriations.-To carry out this section, there are authorized to be appropriated, to remain available until expended-""(1) to the Federal Bureau of Prisons-""(A) $1,375,000 for fiscal year 2003;""(B) $1,110,000 for fiscal year 2004;""(C) $1,130,000 for fiscal year 2005;""(D) $1,155,000 for fiscal year 2006; and""(E) $1,230,000 for fiscal year 2007; and""(2) to the Federal Judiciary-""(A) $3,380,000 for fiscal year 2003;""(B) $3,540,000 for fiscal year 2004;""(C) $3,720,000 for fiscal year 2005;""(D) $3,910,000 for fiscal year 2006; and""(E) $4,100,000 for fiscal year 2007.""",
3602. Appointment of probation officers,https://uscode.house.gov/view.xhtml?req=granuleid:USC-prelim-title18-section3602&num=0&edition=prelim,"(a) Appointment.-A district court of the United States shall appoint qualified persons to serve, with or without compensation, as probation officers within the jurisdiction and under the direction of the court making the appointment. A person appointed as a probation officer in one district may serve in another district with the consent of the appointing court and the court in the other district. The appointing court may, for cause, remove a probation officer appointed to serve with compensation, and may, in its discretion, remove a probation officer appointed to serve without compensation.(b) Record of Appointment.-The order of appointment shall be entered on the records of the court, a copy of the order shall be delivered to the officer appointed, and a copy shall be sent to the Director of the Administrative Office of the United States Courts.(c) Chief Probation Officer.-If the court appoints more than one probation officer, one may be designated by the court as chief probation officer and shall direct the work of all probation officers serving in the judicial district.(Added Pub. L. 98–473, title II, §212(a)(2), Oct. 12, 1984, 98 Stat. 2001; amended Pub. L. 114–113, div. E, title III, §307, Dec. 18, 2015, 129 Stat. 2443.)Editorial NotesAmendments2015-Subsec. (a). Pub. L. 114–113 inserted ""A person appointed as a probation officer in one district may serve in another district with the consent of the appointing court and the court in the other district."" after first sentence and ""appointing"" before ""court may, for cause, remove"".Statutory Notes and Related SubsidiariesEffective DateSection effective Nov. 1, 1987, and applicable only to offenses committed after the taking effect of this section, see section 235(a)(1) of Pub. L. 98–473, set out as a note under section 3551 of this title.","Amendments2015-Subsec. (a). Pub. L. 114–113 inserted ""A person appointed as a probation officer in one district may serve in another district with the consent of the appointing court and the court in the other district."" after first sentence and ""appointing"" before ""court may, for cause, remove"".Statutory Notes and Related SubsidiariesEffective DateSection effective Nov. 1, 1987, and applicable only to offenses committed after the taking effect of this section, see section 235(a)(1) of Pub. L. 98–473, set out as a note under section 3551 of this title."
3603. Duties of probation officers,https://uscode.house.gov/view.xhtml?req=granuleid:USC-prelim-title18-section3603&num=0&edition=prelim,"A probation officer shall-(1) instruct a probationer or a person on supervised release, who is under his supervision, as to the conditions specified by the sentencing court, and provide him with a written statement clearly setting forth all such conditions;(2) keep informed, to the degree required by the conditions specified by the sentencing court, as to the conduct and condition of a probationer or a person on supervised release, who is under his supervision, and report his conduct and condition to the sentencing court;(3) use all suitable methods, not inconsistent with the conditions specified by the court, to aid a probationer or a person on supervised release who is under his supervision, and to bring about improvements in his conduct and condition;(4) be responsible for the supervision of any probationer or a person on supervised release who is known to be within the judicial district;(5) keep a record of his work, and make such reports to the Director of the Administrative Office of the United States Courts as the Director may require;(6) upon request of the Attorney General or his designee, assist in the supervision of and furnish information about, a person within the custody of the Attorney General while on work release, furlough, or other authorized release from his regular place of confinement, or while in prerelease custody pursuant to the provisions of section 3624(c);(7) keep informed concerning the conduct, condition, and compliance with any condition of probation, including the payment of a fine or restitution of each probationer under his supervision and report thereon to the court placing such person on probation and report to the court any failure of a probationer under his supervision to pay a fine in default within thirty days after notification that it is in default so that the court may determine whether probation should be revoked;(8)(A) when directed by the court, and to the degree required by the regimen of care or treatment ordered by the court as a condition of release, keep informed as to the conduct and provide supervision of a person conditionally released under the provisions of section 4243, 4246, or 4248 of this title, and report such person's conduct and condition to the court ordering release and to the Attorney General or his designee; and(B) immediately report any violation of the conditions of release to the court and the Attorney General or his designee;(9) if approved by the district court, be authorized to carry firearms under such rules and regulations as the Director of the Administrative Office of the United States Courts may prescribe; and(10) perform any other duty that the court may designate.(Added Pub. L. 98–473, title II, §212(a)(2), Oct. 12, 1984, 98 Stat. 2002; amended Pub. L. 99–646, §15(a), Nov. 10, 1986, 100 Stat. 3595; Pub. L. 102–572, title VII, §701(a), Oct. 29, 1992, 106 Stat. 4514; Pub. L. 104–317, title I, §101(a), Oct. 19, 1996, 110 Stat. 3848; Pub. L. 115–391, title VI, §609(a), Dec. 21, 2018, 132 Stat. 5245.)Editorial NotesAmendments2018-Par. (8)(A). Pub. L. 115–391 substituted "", 4246, or 4248"" for ""or 4246"".1996-Pars. (9), (10). Pub. L. 104–317 added par. (9) and redesignated former par. (9) as (10).1992-Pars. (8), (9). Pub. L. 102–572 added par. (8) and redesignated former par. (8) as (9).1986-Pub. L. 99–646 redesignated pars. (a) to (h) as (1) to (8), respectively, and in par. (6) substituted ""assist in the supervision of"" for ""supervise"" and inserted a comma after ""about"".Statutory Notes and Related SubsidiariesEffective Date of 1992 AmendmentAmendment by Pub. L. 102–572 effective Jan. 1, 1993, see section 1101 of Pub. L. 102–572, set out as a note under section 905 of Title 2, The Congress.Effective Date of 1986 AmendmentPub. L. 99–646, §15(b), Nov. 10, 1986, 100 Stat. 3595, provided that: ""The amendments made by this section [amending this section] shall take effect on the date of the taking effect of section 3603 of title 18, United States Code [Nov. 1, 1987].""Effective DateSection effective Nov. 1, 1987, and applicable only to offenses committed after the taking effect of this section, see section 235(a)(1) of Pub. L. 98–473, set out as a note under section 3551 of this title.","Amendments2018-Par. (8)(A). Pub. L. 115–391 substituted "", 4246, or 4248"" for ""or 4246"".1996-Pars. (9), (10). Pub. L. 104–317 added par. (9) and redesignated former par. (9) as (10).1992-Pars. (8), (9). Pub. L. 102–572 added par. (8) and redesignated former par. (8) as (9).1986-Pub. L. 99–646 redesignated pars. (a) to (h) as (1) to (8), respectively, and in par. (6) substituted ""assist in the supervision of"" for ""supervise"" and inserted a comma after ""about"".Statutory Notes and Related SubsidiariesEffective Date of 1992 AmendmentAmendment by Pub. L. 102–572 effective Jan. 1, 1993, see section 1101 of Pub. L. 102–572, set out as a note under section 905 of Title 2, The Congress.Effective Date of 1986 AmendmentPub. L. 99–646, §15(b), Nov. 10, 1986, 100 Stat. 3595, provided that: ""The amendments made by this section [amending this section] shall take effect on the date of the taking effect of section 3603 of title 18, United States Code [Nov. 1, 1987].""Effective DateSection effective Nov. 1, 1987, and applicable only to offenses committed after the taking effect of this section, see section 235(a)(1) of Pub. L. 98–473, set out as a note under section 3551 of this title."
3604. Transportation of a probationer,https://uscode.house.gov/view.xhtml?req=granuleid:USC-prelim-title18-section3604&num=0&edition=prelim,"A court, after imposing a sentence of probation, may direct a United States marshal to furnish the probationer with-(a) transportation to the place to which he is required to proceed as a condition of his probation; and(b) money, not to exceed such amount as the Attorney General may prescribe, for subsistence expenses while traveling to his destination.(Added Pub. L. 98–473, title II, §212(a)(2), Oct. 12, 1984, 98 Stat. 2002.)Statutory Notes and Related SubsidiariesEffective DateSection effective Nov. 1, 1987, and applicable only to offenses committed after the taking effect of this section, see section 235(a)(1) of Pub. L. 98–473, set out as a note under section 3551 of this title.",
3605. Transfer of jurisdiction over a probationer,https://uscode.house.gov/view.xhtml?req=granuleid:USC-prelim-title18-section3605&num=0&edition=prelim,"A court, after imposing a sentence, may transfer jurisdiction over a probationer or person on supervised release to the district court for any other district to which the person is required to proceed as a condition of his probation or release, or is permitted to proceed, with the concurrence of such court. A later transfer of jurisdiction may be made in the same manner. A court to which jurisdiction is transferred under this section is authorized to exercise all powers over the probationer or releasee that are permitted by this subchapter or subchapter B or D of chapter 227.(Added Pub. L. 98–473, title II, §212(a)(2), Oct. 12, 1984, 98 Stat. 2003.)Statutory Notes and Related SubsidiariesEffective DateSection effective Nov. 1, 1987, and applicable only to offenses committed after the taking effect of this section, see section 235(a)(1) of Pub. L. 98–473, set out as a note under section 3551 of this title.",
3606. Arrest and return of a probationer,https://uscode.house.gov/view.xhtml?req=granuleid:USC-prelim-title18-section3606&num=0&edition=prelim,"If there is probable cause to believe that a probationer or a person on supervised release has violated a condition of his probation or release, he may be arrested, and, upon arrest, shall be taken without unnecessary delay before the court having jurisdiction over him. A probation officer may make such an arrest wherever the probationer or releasee is found, and may make the arrest without a warrant. The court having supervision of the probationer or releasee, or, if there is no such court, the court last having supervision of the probationer or releasee, may issue a warrant for the arrest of a probationer or releasee for violation of a condition of release, and a probation officer or United States marshal may execute the warrant in the district in which the warrant was issued or in any district in which the probationer or releasee is found.(Added Pub. L. 98–473, title II, §212(a)(2), Oct. 12, 1984, 98 Stat. 2003.)Statutory Notes and Related SubsidiariesEffective DateSection effective Nov. 1, 1987, and applicable only to offenses committed after the taking effect of this section, see section 235(a)(1) of Pub. L. 98–473, set out as a note under section 3551 of this title.",
