Section,Url,Content,Metadata
3554. Order of criminal forfeiture,https://uscode.house.gov/view.xhtml?req=granuleid:USC-prelim-title18-section3554&num=0&edition=prelim,"The court, in imposing a sentence on a defendant who has been found guilty of an offense described in section 1962 of this title or in title II or III of the Comprehensive Drug Abuse Prevention and Control Act of 1970 shall order, in addition to the sentence that is imposed pursuant to the provisions of section 3551, that the defendant forfeit property to the United States in accordance with the provisions of section 1963 of this title or section 413 of the Comprehensive Drug Abuse and Control Act of 1970.(Added Pub. L. 98–473, title II, §212(a)(2), Oct. 12, 1984, 98 Stat. 1990.)Editorial NotesReferences in TextThe Comprehensive Drug Abuse Prevention and Control Act of 1970, referred to in text, is Pub. L. 91–513, Oct. 27, 1970, 84 Stat. 1236. Title II of this Act, known as the Controlled Substances Act, is classified principally to subchapter I (§801 et seq.) of chapter 13 of Title 21, Food and Drugs. Title III of this Act, known as the Controlled Substances Import and Export Act, is classified principally to subchapter II (§951 et seq.) of chapter 13 of Title 21. Section 413 of this Act is classified to section 853 of Title 21. For complete classification of this Act to the Code, see Short Title note set out under sections 801 and 951 of Title 21 and Tables.Statutory Notes and Related SubsidiariesEffective DateSection effective Nov. 1, 1987, and applicable only to offenses committed after the taking effect of this section, see section 235(a)(1) of Pub. L. 98–473, set out as a note under section 3551 of this title.","References in TextThe Comprehensive Drug Abuse Prevention and Control Act of 1970, referred to in text, is Pub. L. 91–513, Oct. 27, 1970, 84 Stat. 1236. Title II of this Act, known as the Controlled Substances Act, is classified principally to subchapter I (§801 et seq.) of chapter 13 of Title 21, Food and Drugs. Title III of this Act, known as the Controlled Substances Import and Export Act, is classified principally to subchapter II (§951 et seq.) of chapter 13 of Title 21. Section 413 of this Act is classified to section 853 of Title 21. For complete classification of this Act to the Code, see Short Title note set out under sections 801 and 951 of Title 21 and Tables.Statutory Notes and Related SubsidiariesEffective DateSection effective Nov. 1, 1987, and applicable only to offenses committed after the taking effect of this section, see section 235(a)(1) of Pub. L. 98–473, set out as a note under section 3551 of this title."
3555. Order of notice to victims,https://uscode.house.gov/view.xhtml?req=granuleid:USC-prelim-title18-section3555&num=0&edition=prelim,"The court, in imposing a sentence on a defendant who has been found guilty of an offense involving fraud or other intentionally deceptive practices, may order, in addition to the sentence that is imposed pursuant to the provisions of section 3551, that the defendant give reasonable notice and explanation of the conviction, in such form as the court may approve, to the victims of the offense. The notice may be ordered to be given by mail, by advertising in designated areas or through designated media, or by other appropriate means. In determining whether to require the defendant to give such notice, the court shall consider the factors set forth in section 3553(a) to the extent that they are applicable and shall consider the cost involved in giving the notice as it relates to the loss caused by the offense, and shall not require the defendant to bear the costs of notice in excess of $20,000.(Added Pub. L. 98–473, title II, §212(a)(2), Oct. 12, 1984, 98 Stat. 1991.)Statutory Notes and Related SubsidiariesEffective DateSection effective Nov. 1, 1987, and applicable only to offenses committed after the taking effect of this section, see section 235(a)(1) of Pub. L. 98–473, set out as a note under section 3551 of this title.",
3556. Order of restitution,https://uscode.house.gov/view.xhtml?req=granuleid:USC-prelim-title18-section3556&num=0&edition=prelim,"The court, in imposing a sentence on a defendant who has been found guilty of an offense shall order restitution in accordance with section 3663A, and may order restitution in accordance with section 3663. The procedures under section 3664 shall apply to all orders of restitution under this section.(Added Pub. L. 98–473, title II, §212(a)(2), Oct. 12, 1984, 98 Stat. 1991; amended Pub. L. 99–646, §20(b), Nov. 10, 1986, 100 Stat. 3596; Pub. L. 104–132, title II, §202, Apr. 24, 1996, 110 Stat. 1227.)Editorial NotesAmendments1996-Pub. L. 104–132 substituted ""shall order restitution"" for ""may order restitution"" and ""section 3663A, and may order restitution in accordance with section 3663. The procedures under section 3664 shall apply to all orders of restitution under this section"" for ""sections 3663 and 3664"".1986-Pub. L. 99–646 substituted ""may order restitution in accordance with sections 3663 and 3664"" for ""under this title, or an offense under section 902(h), (i), (j), or (n) of the Federal Aviation Act of 1958 (49 U.S.C. 1472), may order, in addition to the sentence that is imposed pursuant to the provisions of section 3551, that the defendant make restitution to any victim of the offense in accordance with the provisions of sections 3663 and 3664"".Statutory Notes and Related SubsidiariesEffective Date of 1996 AmendmentAmendment by Pub. L. 104–132 to be effective, to extent constitutionally permissible, for sentencing proceedings in cases in which defendant is convicted on or after Apr. 24, 1996, see section 211 of Pub. L. 104–132, set out as a note under section 2248 of this title.Effective Date of 1986 AmendmentPub. L. 99–646, §20(c), Nov. 10, 1986, 100 Stat. 3596, provided that: ""The amendments made by this section [amending this section and section 3663 of this title] shall take effect on the date of the taking effect of section 212(a)(2) of the Sentencing Reform Act of 1984 [section 212(a)(2) of Pub. L. 98–473, effective Nov. 1, 1987].""Effective DateSection effective Nov. 1, 1987, and applicable only to offenses committed after the taking effect of this section, see section 235(a)(1) of Pub. L. 98–473, set out as a note under section 3551 of this title.","Amendments1996-Pub. L. 104–132 substituted ""shall order restitution"" for ""may order restitution"" and ""section 3663A, and may order restitution in accordance with section 3663. The procedures under section 3664 shall apply to all orders of restitution under this section"" for ""sections 3663 and 3664"".1986-Pub. L. 99–646 substituted ""may order restitution in accordance with sections 3663 and 3664"" for ""under this title, or an offense under section 902(h), (i), (j), or (n) of the Federal Aviation Act of 1958 (49 U.S.C. 1472), may order, in addition to the sentence that is imposed pursuant to the provisions of section 3551, that the defendant make restitution to any victim of the offense in accordance with the provisions of sections 3663 and 3664"".Statutory Notes and Related SubsidiariesEffective Date of 1996 AmendmentAmendment by Pub. L. 104–132 to be effective, to extent constitutionally permissible, for sentencing proceedings in cases in which defendant is convicted on or after Apr. 24, 1996, see section 211 of Pub. L. 104–132, set out as a note under section 2248 of this title.Effective Date of 1986 AmendmentPub. L. 99–646, §20(c), Nov. 10, 1986, 100 Stat. 3596, provided that: ""The amendments made by this section [amending this section and section 3663 of this title] shall take effect on the date of the taking effect of section 212(a)(2) of the Sentencing Reform Act of 1984 [section 212(a)(2) of Pub. L. 98–473, effective Nov. 1, 1987].""Effective DateSection effective Nov. 1, 1987, and applicable only to offenses committed after the taking effect of this section, see section 235(a)(1) of Pub. L. 98–473, set out as a note under section 3551 of this title."
3557. Review of a sentence,https://uscode.house.gov/view.xhtml?req=granuleid:USC-prelim-title18-section3557&num=0&edition=prelim,"The review of a sentence imposed pursuant to section 3551 is governed by the provisions of section 3742.(Added Pub. L. 98–473, title II, §212(a)(2), Oct. 12, 1984, 98 Stat. 1991.)Statutory Notes and Related SubsidiariesEffective DateSection effective Nov. 1, 1987, and applicable only to offenses committed after the taking effect of this section, see section 235(a)(1) of Pub. L. 98–473, set out as a note under section 3551 of this title.",
3558. Implementation of a sentence,https://uscode.house.gov/view.xhtml?req=granuleid:USC-prelim-title18-section3558&num=0&edition=prelim,"The implementation of a sentence imposed pursuant to section 3551 is governed by the provisions of chapter 229.(Added Pub. L. 98–473, title II, §212(a)(2), Oct. 12, 1984, 98 Stat. 1991.)Statutory Notes and Related SubsidiariesEffective DateSection effective Nov. 1, 1987, and applicable only to offenses committed after the taking effect of this section, see section 235(a)(1) of Pub. L. 98–473, set out as a note under section 3551 of this title.",
