Section,Url,Content,Metadata
710. Cremation urns for military use,https://uscode.house.gov/view.xhtml?req=granuleid:USC-prelim-title18-section710&num=0&edition=prelim,"Whoever knowingly uses, manufactures, or sells any cremation urn of a design approved by the Secretary of Defense for use to retain the cremated remains of deceased members of the armed forces or an urn which is a colorable imitation of the approved design, except when authorized under regulation made pursuant to law, shall be fined under this title or imprisoned for not more than six months, or both.(Added Sept. 28, 1950, ch. 1092, §1(b), 64 Stat. 1077; amended Pub. L. 103–322, title XXXIII, §330016(1)(E), Sept. 13, 1994, 108 Stat. 2146.)Editorial NotesAmendments1994-Pub. L. 103–322 substituted ""fined under this title"" for ""fined not more than $250"".","Amendments1994-Pub. L. 103–322 substituted ""fined under this title"" for ""fined not more than $250""."
"711. Repealed. Pub. L. 116-260, div. O, title X, §1002(5), Dec. 27, 2020, 134 Stat. 2155",https://uscode.house.gov/view.xhtml?req=granuleid:USC-prelim-title18-section711&num=0&edition=prelim,"18 USC 711: Repealed. Pub. L. 116-260, div. O, title X, §1002(5), Dec. 27, 2020, 134 Stat. 2155            Result 1 of 1                                      Current2018 Ed. and Supplement V (1/3/2024)2018 Ed. and Supplement IV (1/5/2023)2018 Ed. and Supplement III (1/3/2022)2018 Ed. and Supplement II (1/13/2021)2018 Ed. and Supplement I (1/24/2020)2018 Main Ed. (1/14/2019)2012 Ed. and Supplement V (1/12/2018)2012 Ed. and Supplement IV (1/6/2017)2012 Ed. and Supplement III (1/3/2016)2012 Ed. and Supplement II (1/5/2015)2012 Ed. and Supplement I (1/16/2014)2012 Main Ed. (1/15/2013)2006 Ed. and Supplement V (1/3/2012)2006 Ed. and Supplement IV (1/7/2011)2006 Ed. and Supplement III (2/1/2010)2006 Ed. and Supplement II (1/5/2009)2006 Ed. and Supplement I (1/8/2008)2006 Main Ed. (1/3/2007)2000 Ed. and Supplement V (1/2/2006)2000 Ed. and Supplement IV (1/3/2005)2000 Ed. and Supplement III (1/19/2004)2000 Ed. and Supplement II (1/6/2003)2000 Ed. and Supplement I (1/22/2002)2000 Main Ed. (1/2/2001)1994 Ed. and Supplement V (1/23/2000)1994 Ed. and Supplement IV (1/5/1999)1994 Ed. and Supplement III (1/26/1998)1994 Ed. and Supplement II (1/6/1997)1994 Ed. and Supplement I (1/16/1996)1994 Main Ed. (1/4/1995)                         Back to Original Document << Previous                                 TITLE 18 / PART I / CHAPTER 33 / § 711                                 Next >>[Print]                                  [Print selection][OLRC Home]Help 18 USC 711: Repealed. Pub. L. 116-260, div. O, title X, §1002(5), Dec. 27, 2020, 134 Stat. 2155Text contains those laws in effect on September 27, 2024From Title 18-CRIMES AND CRIMINAL PROCEDUREPART I-CRIMESCHAPTER 33-EMBLEMS, INSIGNIA, AND NAMES[§711. Repealed. Pub. L. 116–260, div. O, title X, §1002(5), Dec. 27, 2020, 134 Stat. 2155]Section, added May 23, 1952, ch. 327, §1, 66 Stat. 92; amended Pub. L. 93–318, §5, June 22, 1974, 88 Stat. 245; Pub. L. 103–322, title XXXIII, §§330004(4), 330016(1)(E), Sept. 13, 1994, 108 Stat. 2141, 2146, penalized unauthorized use of the ""Smokey Bear"" character or name.",
"711. a. Repealed. Pub. L. 116-260, div. O, title X, §1002(6), Dec. 27, 2020, 134 Stat. 2155",https://uscode.house.gov/view.xhtml?req=granuleid:USC-prelim-title18-section711a&num=0&edition=prelim,"18 USC 711a: Repealed. Pub. L. 116-260, div. O, title X, §1002(6), Dec. 27, 2020, 134 Stat. 2155            Result 1 of 1                                      Current2018 Ed. and Supplement V (1/3/2024)2018 Ed. and Supplement IV (1/5/2023)2018 Ed. and Supplement III (1/3/2022)2018 Ed. and Supplement II (1/13/2021)2018 Ed. and Supplement I (1/24/2020)2018 Main Ed. (1/14/2019)2012 Ed. and Supplement V (1/12/2018)2012 Ed. and Supplement IV (1/6/2017)2012 Ed. and Supplement III (1/3/2016)2012 Ed. and Supplement II (1/5/2015)2012 Ed. and Supplement I (1/16/2014)2012 Main Ed. (1/15/2013)2006 Ed. and Supplement V (1/3/2012)2006 Ed. and Supplement IV (1/7/2011)2006 Ed. and Supplement III (2/1/2010)2006 Ed. and Supplement II (1/5/2009)2006 Ed. and Supplement I (1/8/2008)2006 Main Ed. (1/3/2007)2000 Ed. and Supplement V (1/2/2006)2000 Ed. and Supplement IV (1/3/2005)2000 Ed. and Supplement III (1/19/2004)2000 Ed. and Supplement II (1/6/2003)2000 Ed. and Supplement I (1/22/2002)2000 Main Ed. (1/2/2001)1994 Ed. and Supplement V (1/23/2000)1994 Ed. and Supplement IV (1/5/1999)1994 Ed. and Supplement III (1/26/1998)1994 Ed. and Supplement II (1/6/1997)1994 Ed. and Supplement I (1/16/1996)1994 Main Ed. (1/4/1995)                         Back to Original Document << Previous                                 TITLE 18 / PART I / CHAPTER 33 / § 711a                                 Next >>[Print]                                  [Print selection][OLRC Home]Help 18 USC 711a: Repealed. Pub. L. 116-260, div. O, title X, §1002(6), Dec. 27, 2020, 134 Stat. 2155Text contains those laws in effect on September 27, 2024From Title 18-CRIMES AND CRIMINAL PROCEDUREPART I-CRIMESCHAPTER 33-EMBLEMS, INSIGNIA, AND NAMES[§711a. Repealed. Pub. L. 116–260, div. O, title X, §1002(6), Dec. 27, 2020, 134 Stat. 2155]Section, added Pub. L. 93–318, §6, June 22, 1974, 88 Stat. 245; amended Pub. L. 103–322, title XXXIII, §330016(1)(E), Sept. 13, 1994, 108 Stat. 2146, penalized unauthorized use of the ""Woodsy Owl"" character, name, or slogan.",
"712. Misuse of names, words, emblems, or insignia",https://uscode.house.gov/view.xhtml?req=granuleid:USC-prelim-title18-section712&num=0&edition=prelim,"Whoever, in the course of collecting or aiding in the collection of private debts or obligations, or being engaged in furnishing private police, investigation, or other private detective services, uses or employs in any communication, correspondence, notice, advertisement, or circular the words ""national"", ""Federal"", or ""United States"", the initials ""U.S."", or any emblem, insignia, or name, for the purpose of conveying and in a manner reasonably calculated to convey the false impression that such communication is from a department, agency, bureau, or instrumentality of the United States or in any manner represents the United States, shall be fined under this title or imprisoned not more than one year, or both.(Added Pub. L. 86–291, §1, Sept. 21, 1959, 73 Stat. 570; amended Pub. L. 93–147, §1(a), Nov. 3, 1973, 87 Stat. 554; Pub. L. 103–322, title XXXIII, §330016(1)(H), Sept. 13, 1994, 108 Stat. 2147.)Editorial NotesAmendments1994-Pub. L. 103–322 substituted ""fined under this title"" for ""fined not more than $1,000"".1973-Pub. L. 93–147 substituted ""Misuse of names, words, emblems, or insignia"" for ""Misuse of names by collecting agencies or private detective agencies to indicate Federal agency"" in section catchline and substituted ""in the course"" and ""such communication is from a department"" for ""being engaged in the business"" and ""such business is a department"" respectively, and struck out ""as part of the firm name of such business,"" after ""detective services, uses"".Statutory Notes and Related SubsidiariesEffective DatePub. L. 86–291, §2, Sept. 21, 1959, 73 Stat. 570, provided that: ""The provisions of this section [enacting this section] shall become effective sixty days from the enactment thereof [Sept. 21, 1959].""","Amendments1994-Pub. L. 103–322 substituted ""fined under this title"" for ""fined not more than $1,000"".1973-Pub. L. 93–147 substituted ""Misuse of names, words, emblems, or insignia"" for ""Misuse of names by collecting agencies or private detective agencies to indicate Federal agency"" in section catchline and substituted ""in the course"" and ""such communication is from a department"" for ""being engaged in the business"" and ""such business is a department"" respectively, and struck out ""as part of the firm name of such business,"" after ""detective services, uses"".Statutory Notes and Related SubsidiariesEffective DatePub. L. 86–291, §2, Sept. 21, 1959, 73 Stat. 570, provided that: ""The provisions of this section [enacting this section] shall become effective sixty days from the enactment thereof [Sept. 21, 1959]."""
"713. Use of likenesses of the great seal of the United States, the seals of the President and Vice President, the seal of the United States Senate, the seal of the United States House of Representatives, and the seal of the United States Congress",https://uscode.house.gov/view.xhtml?req=granuleid:USC-prelim-title18-section713&num=0&edition=prelim,"(a) Whoever knowingly displays any printed or other likeness of the great seal of the United States, or of the seals of the President or the Vice President of the United States, or the seal of the United States Senate, or the seal of the United States House of Representatives, or the seal of the United States Congress, or any facsimile thereof, in, or in connection with, any advertisement, poster, circular, book, pamphlet, or other publication, public meeting, play, motion picture, telecast, or other production, or on any building, monument, or stationery, for the purpose of conveying, or in a manner reasonably calculated to convey, a false impression of sponsorship or approval by the Government of the United States or by any department, agency, or instrumentality thereof, shall be fined under this title or imprisoned not more than six months, or both.(b) Whoever, except as authorized under regulations promulgated by the President and published in the Federal Register, knowingly manufactures, reproduces, sells, or purchases for resale, either separately or appended to any article manufactured or sold, any likeness of the seals of the President or Vice President, or any substantial part thereof, except for manufacture or sale of the article for the official use of the Government of the United States, shall be fined under this title or imprisoned not more than six months, or both.(c) Whoever, except as directed by the United States Senate, or the Secretary of the Senate on its behalf, knowingly uses, manufactures, reproduces, sells or purchases for resale, either separately or appended to any article manufactured or sold, any likeness of the seal of the United States Senate, or any substantial part thereof, except for manufacture or sale of the article for the official use of the Government of the United States, shall be fined under this title or imprisoned not more than six months, or both.(d) Whoever, except as directed by the United States House of Representatives, or the Clerk of the House of Representatives on its behalf, knowingly uses, manufactures, reproduces, sells or purchases for resale, either separately or appended to any article manufactured or sold, any likeness of the seal of the United States House of Representatives, or any substantial part thereof, except for manufacture or sale of the article for the official use of the Government of the United States, shall be fined under this title or imprisoned not more than six months, or both.(e) Whoever, except as directed by the United States Congress, or the Secretary of the Senate and the Clerk of the House of Representatives, acting jointly on its behalf, knowingly uses, manufactures, reproduces, sells or purchases for resale, either separately or appended to any article manufactured or sold, any likeness of the seal of the United States Congress, or any substantial part thereof, except for manufacture or sale of the article for the official use of the Government of the United States, shall be fined under this title or imprisoned not more than six months, or both.(f) A violation of the provisions of this section may be enjoined at the suit of the Attorney General,(1) in the case of the great seal of the United States and the seals of the President and Vice President, upon complaint by any authorized representative of any department or agency of the United States;(2) in the case of the seal of the United States Senate, upon complaint by the Secretary of the Senate;(3) in the case of the seal of the United States House of Representatives, upon complaint by the Clerk of the House of Representatives; and(4) in the case of the seal of the United States Congress, upon complaint by the Secretary of the Senate and the Clerk of the House of Representatives, acting jointly.(Added Pub. L. 89–807, §1(a), Nov. 11, 1966, 80 Stat. 1525; amended Pub. L. 91–651, §1, Jan. 5, 1971, 84 Stat. 1940; Pub. L. 102–229, title II, §210(a)–(d), Dec. 12, 1991, 105 Stat. 1717; Pub. L. 103–322, title XXXIII, §330016(1)(E), Sept. 13, 1994, 108 Stat. 2146; Pub. L. 105–55, title III, §308(a)–(d), Oct. 7, 1997, 111 Stat. 1198.)Editorial NotesAmendments1997-Pub. L. 105–55, §308(d), substituted ""the seal of the United States Senate, the seal of the United States House of Representatives, and the seal of the United States Congress"" for ""and the seal of the United States Senate"" in section catchline.Subsec. (a). Pub. L. 105–55, §308(a), inserted ""or the seal of the United States House of Representatives, or the seal of the United States Congress,"" after ""Senate,"".Subsecs. (d), (e). Pub. L. 105–55, §308(b), added subsecs. (d) and (e). Former subsec. (d) redesignated (f).Subsec. (f). Pub. L. 105–55, §308(b)(1), redesignated subsec. (d) as (f).Subsec. (f)(3), (4). Pub. L. 105–55, §308(c), added pars. (3) and (4).1994-Subsecs. (a) to (c). Pub. L. 103–322 substituted ""fined under this title"" for ""fined not more than $250"".1991-Pub. L. 102–229, §210(a), substituted ""the seals of the President and Vice President, and the seal of the United States Senate"" for ""and of the seals of the President and Vice President"" in section catchline.Subsec. (a). Pub. L. 102–229, §210(b), inserted ""or the seal of the United States Senate,"" after ""Vice President of the United States,"".Subsecs. (c), (d). Pub. L. 102–229, §210(c), (d), added subsec. (c), amended former subsec. (c) generally, and redesignated former subsec. (c) as (d). Prior to amendment and redesignation, former subsec. (c) read as follows: ""A violation of subsection (a) or (b) of this section may be enjoined at the suit of the Attorney General upon complaint by any authorized representative of any department or agency of the United States.""1971-Pub. L. 91–651 substituted ""Use of likenesses of the great seal of the United States, and of the seals of the President and Vice President"" for ""Use of the great seal of the United States"" in section catchline.Subsec. (a). Pub. L. 91–651 redesignated existing provisions as subsec. (a), expanded prohibition to include likenesses of the seals of the President and Vice President, and added to the enumerated list of prohibited uses for likenesses of the great seal of the United States and for the seals of the President and Vice President, use in posters, public meetings, or on any building, monument, or stationery.Subsecs. (b), (c). Pub. L. 91–651 added subsecs. (b) and (c).Statutory Notes and Related SubsidiariesEffective Date of 1971 AmendmentPub. L. 91–651, §3, Jan. 5, 1971, 84 Stat. 1941, provided that: ""The amendments made by this Act [amending this section] shall not make unlawful any preexisting use of the design of the great seal of the United States or of the seals of the President or Vice President of the United States that was lawful on the date of enactment of this Act [Jan. 5, 1971], until one year after the date of such enactment.""Executive DocumentsEx. Ord. No. 11649. Regulations Governing Seals of President and Vice President of United StatesEx. Ord. No. 11649, Feb. 16, 1972, 37 F.R. 3625, as amended by Ex. Ord. No. 11916, May 28, 1976, 41 F.R. 22031, provided:By virtue to the authority vested in me by section 713(b) of title 18, United States Code, I hereby prescribe the following regulations governing the use of the Seals of the President and the Vice President of the United States:Section 1. Except as otherwise provided by law, the knowing manufacture, reproduction, sale, or purchase for resale of the Seals or Coats of Arms of the President or the Vice President of the United States, or any likeness or substantial part thereof, shall be permitted only for the following uses:(a) Use by the President or Vice President of the United States;(b) Use in encyclopedias, dictionaries, books, journals, pamphlets, periodicals, or magazines incident to a description or history of seals, coats of arms, heraldry, or the Presidency or Vice Presidency;(c) Use in libraries, museums, or educational facilities incident to descriptions or exhibits relating to seals, coats of arms, heraldry, or the Presidency or Vice Presidency;(d) Use as an architectural embellishment in libraries, museums, or archives established to house the papers or effects of former Presidents or Vice Presidents;(e) Use on a monument to a former President or Vice President;(f) Use by way of photographic or electronic visual reproduction in pictures, moving pictures, or telecasts of bona fide news content;(g) Such other uses for exceptional historical, educational, or newsworthy purposes as may be authorized in writing by the Counsel to the President.Sec. 2. The manufacture, reproduction, sale, or purchase for resale, either separately or appended to any article manufactured or sold, of the Seals of the President or Vice President, or any likeness or substantial part thereof, except as provided in this Order or as otherwise provided by law, is prohibited.Richard Nixon.","Amendments1997-Pub. L. 105–55, §308(d), substituted ""the seal of the United States Senate, the seal of the United States House of Representatives, and the seal of the United States Congress"" for ""and the seal of the United States Senate"" in section catchline.Subsec. (a). Pub. L. 105–55, §308(a), inserted ""or the seal of the United States House of Representatives, or the seal of the United States Congress,"" after ""Senate,"".Subsecs. (d), (e). Pub. L. 105–55, §308(b), added subsecs. (d) and (e). Former subsec. (d) redesignated (f).Subsec. (f). Pub. L. 105–55, §308(b)(1), redesignated subsec. (d) as (f).Subsec. (f)(3), (4). Pub. L. 105–55, §308(c), added pars. (3) and (4).1994-Subsecs. (a) to (c). Pub. L. 103–322 substituted ""fined under this title"" for ""fined not more than $250"".1991-Pub. L. 102–229, §210(a), substituted ""the seals of the President and Vice President, and the seal of the United States Senate"" for ""and of the seals of the President and Vice President"" in section catchline.Subsec. (a). Pub. L. 102–229, §210(b), inserted ""or the seal of the United States Senate,"" after ""Vice President of the United States,"".Subsecs. (c), (d). Pub. L. 102–229, §210(c), (d), added subsec. (c), amended former subsec. (c) generally, and redesignated former subsec. (c) as (d). Prior to amendment and redesignation, former subsec. (c) read as follows: ""A violation of subsection (a) or (b) of this section may be enjoined at the suit of the Attorney General upon complaint by any authorized representative of any department or agency of the United States.""1971-Pub. L. 91–651 substituted ""Use of likenesses of the great seal of the United States, and of the seals of the President and Vice President"" for ""Use of the great seal of the United States"" in section catchline.Subsec. (a). Pub. L. 91–651 redesignated existing provisions as subsec. (a), expanded prohibition to include likenesses of the seals of the President and Vice President, and added to the enumerated list of prohibited uses for likenesses of the great seal of the United States and for the seals of the President and Vice President, use in posters, public meetings, or on any building, monument, or stationery.Subsecs. (b), (c). Pub. L. 91–651 added subsecs. (b) and (c).Statutory Notes and Related SubsidiariesEffective Date of 1971 AmendmentPub. L. 91–651, §3, Jan. 5, 1971, 84 Stat. 1941, provided that: ""The amendments made by this Act [amending this section] shall not make unlawful any preexisting use of the design of the great seal of the United States or of the seals of the President or Vice President of the United States that was lawful on the date of enactment of this Act [Jan. 5, 1971], until one year after the date of such enactment.""Executive DocumentsEx. Ord. No. 11649. Regulations Governing Seals of President and Vice President of United StatesEx. Ord. No. 11649, Feb. 16, 1972, 37 F.R. 3625, as amended by Ex. Ord. No. 11916, May 28, 1976, 41 F.R. 22031, provided:By virtue to the authority vested in me by section 713(b) of title 18, United States Code, I hereby prescribe the following regulations governing the use of the Seals of the President and the Vice President of the United States:Section 1. Except as otherwise provided by law, the knowing manufacture, reproduction, sale, or purchase for resale of the Seals or Coats of Arms of the President or the Vice President of the United States, or any likeness or substantial part thereof, shall be permitted only for the following uses:(a) Use by the President or Vice President of the United States;(b) Use in encyclopedias, dictionaries, books, journals, pamphlets, periodicals, or magazines incident to a description or history of seals, coats of arms, heraldry, or the Presidency or Vice Presidency;(c) Use in libraries, museums, or educational facilities incident to descriptions or exhibits relating to seals, coats of arms, heraldry, or the Presidency or Vice Presidency;(d) Use as an architectural embellishment in libraries, museums, or archives established to house the papers or effects of former Presidents or Vice Presidents;(e) Use on a monument to a former President or Vice President;(f) Use by way of photographic or electronic visual reproduction in pictures, moving pictures, or telecasts of bona fide news content;(g) Such other uses for exceptional historical, educational, or newsworthy purposes as may be authorized in writing by the Counsel to the President.Sec. 2. The manufacture, reproduction, sale, or purchase for resale, either separately or appended to any article manufactured or sold, of the Seals of the President or Vice President, or any likeness or substantial part thereof, except as provided in this Order or as otherwise provided by law, is prohibited.Richard Nixon."
"714. Repealed. Pub. L. 97-258, §2(d)(1)(B), Sept. 13, 1982, 96 Stat. 1058",https://uscode.house.gov/view.xhtml?req=granuleid:USC-prelim-title18-section714&num=0&edition=prelim,"18 USC 714: Repealed. Pub. L. 97-258, §2(d)(1)(B), Sept. 13, 1982, 96 Stat. 1058            Result 1 of 1                                      Current2018 Ed. and Supplement V (1/3/2024)2018 Ed. and Supplement IV (1/5/2023)2018 Ed. and Supplement III (1/3/2022)2018 Ed. and Supplement II (1/13/2021)2018 Ed. and Supplement I (1/24/2020)2018 Main Ed. (1/14/2019)2012 Ed. and Supplement V (1/12/2018)2012 Ed. and Supplement IV (1/6/2017)2012 Ed. and Supplement III (1/3/2016)2012 Ed. and Supplement II (1/5/2015)2012 Ed. and Supplement I (1/16/2014)2012 Main Ed. (1/15/2013)2006 Ed. and Supplement V (1/3/2012)2006 Ed. and Supplement IV (1/7/2011)2006 Ed. and Supplement III (2/1/2010)2006 Ed. and Supplement II (1/5/2009)2006 Ed. and Supplement I (1/8/2008)2006 Main Ed. (1/3/2007)2000 Ed. and Supplement V (1/2/2006)2000 Ed. and Supplement IV (1/3/2005)2000 Ed. and Supplement III (1/19/2004)2000 Ed. and Supplement II (1/6/2003)2000 Ed. and Supplement I (1/22/2002)2000 Main Ed. (1/2/2001)1994 Ed. and Supplement V (1/23/2000)1994 Ed. and Supplement IV (1/5/1999)1994 Ed. and Supplement III (1/26/1998)1994 Ed. and Supplement II (1/6/1997)1994 Ed. and Supplement I (1/16/1996)1994 Main Ed. (1/4/1995)                         Back to Original Document << Previous                                 TITLE 18 / PART I / CHAPTER 33 / § 714                                 Next >>[Print]                                  [Print selection][OLRC Home]Help 18 USC 714: Repealed. Pub. L. 97-258, §2(d)(1)(B), Sept. 13, 1982, 96 Stat. 1058Text contains those laws in effect on September 27, 2024From Title 18-CRIMES AND CRIMINAL PROCEDUREPART I-CRIMESCHAPTER 33-EMBLEMS, INSIGNIA, AND NAMES[§714. Repealed. Pub. L. 97–258, §2(d)(1)(B), Sept. 13, 1982, 96 Stat. 1058]Section, added Pub. L. 91–419, §3, Sept. 25, 1970, 84 Stat. 870, defined ""Johnny Horizon"" for purposes of Pub. L. 91–419.",
