Section,Url,Content,Metadata
704. Military medals or decorations,https://uscode.house.gov/view.xhtml?req=granuleid:USC-prelim-title18-section704&num=0&edition=prelim,"(a) In General.-Whoever knowingly purchases, attempts to purchase, solicits for purchase, mails, ships, imports, exports, produces blank certificates of receipt for, manufactures, sells, attempts to sell, advertises for sale, trades, barters, or exchanges for anything of value any decoration or medal authorized by Congress for the armed forces of the United States, or any of the service medals or badges awarded to the members of such forces, or the ribbon, button, or rosette of any such badge, decoration or medal, or any colorable imitation thereof, except when authorized under regulations made pursuant to law, shall be fined under this title or imprisoned not more than six months, or both.(b) Fraudulent Representations About Receipt of Military Decorations or Medals.-Whoever, with intent to obtain money, property, or other tangible benefit, fraudulently holds oneself out to be a recipient of a decoration or medal described in subsection (c)(2) or (d) shall be fined under this title, imprisoned not more than one year, or both.(c) Enhanced Penalty for Offenses Involving Congressional Medal of Honor.-(1) In general.-If a decoration or medal involved in an offense under subsection (a) is a Congressional Medal of Honor, in lieu of the punishment provided in that subsection, the offender shall be fined under this title, imprisoned not more than 1 year, or both.(2) Congressional medal of honor defined.-In this subsection, the term ""Congressional Medal of Honor"" means-(A) a medal of honor awarded under section 7271, 8291, or 9271 of title 10 or section 491 1 of title 14;(B) a duplicate medal of honor issued under section 7284, 8306, or 9284 of title 10 or section 504 1 of title 14; or(C) a replacement of a medal of honor provided under section 7277, 8303, or 9277 of title 10 or section 501 1 of title 14.(d) Enhanced Penalty for Offenses Involving Certain Other Medals.-(1) In general.-If a decoration or medal involved in an offense described in subsection (a) is a distinguished-service cross awarded under section 7272 of title 10, a Navy cross awarded under section 8292 of title 10, an Air Force cross awarded under section 9272 of title 10, a silver star awarded under section 7276, 8294, or 9276 of title 10, a Purple Heart awarded under section 1129 of title 10, a combat badge, or any replacement or duplicate medal for such medal as authorized by law, in lieu of the punishment provided in the applicable subsection, the offender shall be fined under this title, imprisoned not more than 1 year, or both.(2) Combat badge defined.-In this subsection, the term ""combat badge"" means a Combat Infantryman's Badge, Combat Action Badge, Combat Medical Badge, Combat Action Ribbon, or Combat Action Medal.(June 25, 1948, ch. 645, 62 Stat. 732; May 24, 1949, ch. 139, §16, 63 Stat. 92; Pub. L. 103–322, title XXXII, §320109, title XXXIII, §330016(1)(E), Sept. 13, 1994, 108 Stat. 2113, 2146; Pub. L. 103–442, Nov. 2, 1994, 108 Stat. 4630; Pub. L. 104–294, title VI, §604(b)(16), Oct. 11, 1996, 110 Stat. 3507; Pub. L. 107–107, div. A, title V, §553(e), Dec. 28, 2001, 115 Stat. 1117; Pub. L. 109–437, §3, Dec. 20, 2006, 120 Stat. 3266; Pub. L. 113–12, §2, June 3, 2013, 127 Stat. 448; Pub. L. 115–232, div. A, title VIII, §809(e)(1), Aug. 13, 2018, 132 Stat. 1841.)Historical and Revision Notes1948 ActBased on section 1425 of title 10, U.S.C., 1940 ed., Army and Air Force (Feb. 24, 1923, ch. 110, 42 Stat. 1286; Apr. 21, 1928, ch. 392, 45 Stat. 437).Section was made to cover the decorations and medals of the Navy Department as well as the War Department.Minor changes were made in phraseology.1949 ActThis section [section 16] clarifies the wording of section 704 of title 18, U.S.C., to embrace all service decorations awarded to members of the armed forces whether by the Army, Navy, Air Force, or other branch of such forces. (See note to sec. 5 [of 1949 Act, set out in Legislative History note under section 244 of title 18]).Editorial NotesReferences in TextSections 491, 501, and 504 of title 14, referred to in subsec. (c)(2), were redesignated sections 2732, 2745, and 2733, respectively, of title 14 by Pub. L. 115–282, title I, §116(b), Dec. 4, 2018, 132 Stat. 4226, and references to sections 491, 501, and 504 of title 14 deemed to refer to such redesignated sections, see section 123(b)(1) of Pub. L. 115–282, set out as a References to Sections of Title 14 as Redesignated by Pub. L. 115–282 note preceding section 101 of Title 14, Coast Guard.Amendments2018-Subsec. (c)(2)(A). Pub. L. 115–232, §809(e)(1)(A)(i), substituted ""section 7271, 8291, or 9271 of title 10"" for ""section 3741, 6241, or 8741 of title 10"".Subsec. (c)(2)(B). Pub. L. 115–232, §809(e)(1)(A)(ii), substituted ""section 7284, 8306, or 9284 of title 10"" for ""section 3754, 6256, or 8754 of title 10"".Subsec. (c)(2)(C). Pub. L. 115–232, §809(e)(1)(A)(iii), substituted ""section 7277, 8303, or 9277 of title 10"" for ""section 3747, 6253, or 8747 of title 10"".Subsec. (d)(1). Pub. L. 115–232, §809(e)(1)(B), substituted ""section 7272 of title 10"" for ""section 3742 of title 10"", ""section 8292 of title 10"" for ""section 6242 of title 10"", ""section 9272 of title 10"" for ""section 8742 of section 10"", and ""section 7276, 8294, or 9276 of title 10"" for ""section 3746, 6244, or 8746 of title 10"".2013-Subsec. (a). Pub. L. 113–12, §2(a)(1), struck out ""wears,"" after ""Whoever knowingly"".Subsec. (b). Pub. L. 113–12, §2(a)(2), amended subsec. (b) generally. Prior to amendment, text read as follows: ""Whoever falsely represents himself or herself, verbally or in writing, to have been awarded any decoration or medal authorized by Congress for the Armed Forces of the United States, any of the service medals or badges awarded to the members of such forces, the ribbon, button, or rosette of any such badge, decoration, or medal, or any colorable imitation of such item shall be fined under this title, imprisoned not more than six months, or both.""Subsec. (c)(1). Pub. L. 113–12, §2(c), struck out ""or (b)"" after ""subsection (a)"".Subsec. (d). Pub. L. 113–12, §2(b), designated existing provisions as par. (1), inserted heading, inserted ""a combat badge,"" after ""1129 of title 10,"", and added par. (2).Subsec. (d)(1). Pub. L. 113–12, §2(c), struck out ""or (b)"" after ""subsection (a)"".2006-Subsec. (a). Pub. L. 109–437, §3(a), substituted ""purchases, attempts to purchase, solicits for purchase, mails, ships, imports, exports, produces blank certificates of receipt for, manufactures, sells, attempts to sell, advertises for sale, trades, barters, or exchanges for anything of value"" for ""manufactures, or sells"".Subsec. (b). Pub. L. 109–437, §3(b)(2), added subsec. (b). Former subsec. (b) redesignated (c).Subsec. (c). Pub. L. 109–437, §3(b)(1), (d)(1), redesignated subsec. (b) as (c) and inserted ""Enhanced Penalty for Offenses Involving"" before ""Congressional Medal of Honor"" in heading.Subsec. (c)(1). Pub. L. 109–437, §3(b)(3), inserted ""or (b)"" after ""subsection (a)"".Subsec. (c)(2). Pub. L. 109–437, §3(d)(2), added par. (2) and struck out former par. (2) which defined ""sells"" and ""Congressional Medal of Honor"".Subsec. (d). Pub. L. 109–437, §3(c), added subsec. (d).2001-Subsec. (b)(2)(B). Pub. L. 107–107 amended subpar. (B) generally. Prior to amendment, subpar. (B) read as follows: ""As used in this subsection, 'Congressional Medal of Honor' means a medal awarded under section 3741, 6241, or 8741 of title 10.""1996-Subsec. (a). Pub. L. 104–294 amended Pub. L. 103–322, §320109(1). See 1994 Amendment note below.1994-Subsec. (a). Pub. L. 103–322, §§320109(2), 330016(1)(E), amended subsec. (a) identically, substituting ""fined under this title"" for ""fined not more than $250"".Pub. L. 103–322, §320109(1), as amended by Pub. L. 104–294, §604(b)(16), designated existing provisions as subsec. (a) and inserted heading.Subsec. (b). Pub. L. 103–322, §320109(3), added subsec. (b).Subsec. (b)(2)(B). Pub. L. 103–442 inserted "", 6241, or 8741"" after ""3741"".1949-Act May 24, 1949, covered all service decorations awarded members of the armed forces by any of the armed services.Statutory Notes and Related SubsidiariesReferences to Sections of Title 14 as Redesignated by Pub. L. 115–282Sections 491, 501, and 504 of title 14 redesignated sections 2732, 2745, and 2733, respectively, of title 14 by Pub. L. 115–282, title I, §116(b), Dec. 4, 2018, 132 Stat. 4226, and references to sections 491, 501, and 504 of title 14 deemed to refer to such redesignated sections, see section 123(b)(1) of Pub. L. 115–282, set out as a note preceding section 101 of Title 14, Coast Guard.Effective Date of 2018 AmendmentAmendment by Pub. L. 115–232 effective Feb. 1, 2019, with provision for the coordination of amendments and special rule for certain redesignations, see section 800 of Pub. L. 115–232, set out as a note preceding section 3001 of Title 10, Armed Forces.Effective Date of 1996 AmendmentAmendment by Pub. L. 104–294 effective Sept. 13, 1994, see section 604(d) of Pub. L. 104–294, set out as a note under section 13 of this title.FindingsPub. L. 109–437, §2, Dec. 20, 2006, 120 Stat. 3266, provided that: ""Congress makes the following findings:""(1) Fraudulent claims surrounding the receipt of the Medal of Honor, the distinguished-service cross, the Navy cross, the Air Force cross, the Purple Heart, and other decorations and medals awarded by the President or the Armed Forces of the United States damage the reputation and meaning of such decorations and medals.""(2) Federal law enforcement officers have limited ability to prosecute fraudulent claims of receipt of military decorations and medals.""(3) Legislative action is necessary to permit law enforcement officers to protect the reputation and meaning of military decorations and medals.""1 See References in Text note below.","References in TextSections 491, 501, and 504 of title 14, referred to in subsec. (c)(2), were redesignated sections 2732, 2745, and 2733, respectively, of title 14 by Pub. L. 115–282, title I, §116(b), Dec. 4, 2018, 132 Stat. 4226, and references to sections 491, 501, and 504 of title 14 deemed to refer to such redesignated sections, see section 123(b)(1) of Pub. L. 115–282, set out as a References to Sections of Title 14 as Redesignated by Pub. L. 115–282 note preceding section 101 of Title 14, Coast Guard.Amendments2018-Subsec. (c)(2)(A). Pub. L. 115–232, §809(e)(1)(A)(i), substituted ""section 7271, 8291, or 9271 of title 10"" for ""section 3741, 6241, or 8741 of title 10"".Subsec. (c)(2)(B). Pub. L. 115–232, §809(e)(1)(A)(ii), substituted ""section 7284, 8306, or 9284 of title 10"" for ""section 3754, 6256, or 8754 of title 10"".Subsec. (c)(2)(C). Pub. L. 115–232, §809(e)(1)(A)(iii), substituted ""section 7277, 8303, or 9277 of title 10"" for ""section 3747, 6253, or 8747 of title 10"".Subsec. (d)(1). Pub. L. 115–232, §809(e)(1)(B), substituted ""section 7272 of title 10"" for ""section 3742 of title 10"", ""section 8292 of title 10"" for ""section 6242 of title 10"", ""section 9272 of title 10"" for ""section 8742 of section 10"", and ""section 7276, 8294, or 9276 of title 10"" for ""section 3746, 6244, or 8746 of title 10"".2013-Subsec. (a). Pub. L. 113–12, §2(a)(1), struck out ""wears,"" after ""Whoever knowingly"".Subsec. (b). Pub. L. 113–12, §2(a)(2), amended subsec. (b) generally. Prior to amendment, text read as follows: ""Whoever falsely represents himself or herself, verbally or in writing, to have been awarded any decoration or medal authorized by Congress for the Armed Forces of the United States, any of the service medals or badges awarded to the members of such forces, the ribbon, button, or rosette of any such badge, decoration, or medal, or any colorable imitation of such item shall be fined under this title, imprisoned not more than six months, or both.""Subsec. (c)(1). Pub. L. 113–12, §2(c), struck out ""or (b)"" after ""subsection (a)"".Subsec. (d). Pub. L. 113–12, §2(b), designated existing provisions as par. (1), inserted heading, inserted ""a combat badge,"" after ""1129 of title 10,"", and added par. (2).Subsec. (d)(1). Pub. L. 113–12, §2(c), struck out ""or (b)"" after ""subsection (a)"".2006-Subsec. (a). Pub. L. 109–437, §3(a), substituted ""purchases, attempts to purchase, solicits for purchase, mails, ships, imports, exports, produces blank certificates of receipt for, manufactures, sells, attempts to sell, advertises for sale, trades, barters, or exchanges for anything of value"" for ""manufactures, or sells"".Subsec. (b). Pub. L. 109–437, §3(b)(2), added subsec. (b). Former subsec. (b) redesignated (c).Subsec. (c). Pub. L. 109–437, §3(b)(1), (d)(1), redesignated subsec. (b) as (c) and inserted ""Enhanced Penalty for Offenses Involving"" before ""Congressional Medal of Honor"" in heading.Subsec. (c)(1). Pub. L. 109–437, §3(b)(3), inserted ""or (b)"" after ""subsection (a)"".Subsec. (c)(2). Pub. L. 109–437, §3(d)(2), added par. (2) and struck out former par. (2) which defined ""sells"" and ""Congressional Medal of Honor"".Subsec. (d). Pub. L. 109–437, §3(c), added subsec. (d).2001-Subsec. (b)(2)(B). Pub. L. 107–107 amended subpar. (B) generally. Prior to amendment, subpar. (B) read as follows: ""As used in this subsection, 'Congressional Medal of Honor' means a medal awarded under section 3741, 6241, or 8741 of title 10.""1996-Subsec. (a). Pub. L. 104–294 amended Pub. L. 103–322, §320109(1). See 1994 Amendment note below.1994-Subsec. (a). Pub. L. 103–322, §§320109(2), 330016(1)(E), amended subsec. (a) identically, substituting ""fined under this title"" for ""fined not more than $250"".Pub. L. 103–322, §320109(1), as amended by Pub. L. 104–294, §604(b)(16), designated existing provisions as subsec. (a) and inserted heading.Subsec. (b). Pub. L. 103–322, §320109(3), added subsec. (b).Subsec. (b)(2)(B). Pub. L. 103–442 inserted "", 6241, or 8741"" after ""3741"".1949-Act May 24, 1949, covered all service decorations awarded members of the armed forces by any of the armed services.Statutory Notes and Related SubsidiariesReferences to Sections of Title 14 as Redesignated by Pub. L. 115–282Sections 491, 501, and 504 of title 14 redesignated sections 2732, 2745, and 2733, respectively, of title 14 by Pub. L. 115–282, title I, §116(b), Dec. 4, 2018, 132 Stat. 4226, and references to sections 491, 501, and 504 of title 14 deemed to refer to such redesignated sections, see section 123(b)(1) of Pub. L. 115–282, set out as a note preceding section 101 of Title 14, Coast Guard.Effective Date of 2018 AmendmentAmendment by Pub. L. 115–232 effective Feb. 1, 2019, with provision for the coordination of amendments and special rule for certain redesignations, see section 800 of Pub. L. 115–232, set out as a note preceding section 3001 of Title 10, Armed Forces.Effective Date of 1996 AmendmentAmendment by Pub. L. 104–294 effective Sept. 13, 1994, see section 604(d) of Pub. L. 104–294, set out as a note under section 13 of this title.FindingsPub. L. 109–437, §2, Dec. 20, 2006, 120 Stat. 3266, provided that: ""Congress makes the following findings:""(1) Fraudulent claims surrounding the receipt of the Medal of Honor, the distinguished-service cross, the Navy cross, the Air Force cross, the Purple Heart, and other decorations and medals awarded by the President or the Armed Forces of the United States damage the reputation and meaning of such decorations and medals.""(2) Federal law enforcement officers have limited ability to prosecute fraudulent claims of receipt of military decorations and medals.""(3) Legislative action is necessary to permit law enforcement officers to protect the reputation and meaning of military decorations and medals.""1 See References in Text note below."
705. Badge or medal of veterans' organizations,https://uscode.house.gov/view.xhtml?req=granuleid:USC-prelim-title18-section705&num=0&edition=prelim,"Whoever knowingly manufactures, reproduces, sells or purchases for resale, either separately or on or appended to, any article of merchandise manufactured or sold, any badge, medal, emblem, or other insignia or any colorable imitation thereof, of any veterans' organization incorporated by enactment of Congress, or of any organization formally recognized by any such veterans' organization as an auxiliary of such veterans' organization, or knowingly prints, lithographs, engraves or otherwise reproduces on any poster, circular, periodical, magazine, newspaper, or other publication, or circulates or distributes any such printed matter bearing a reproduction of such badge, medal, emblem, or other insignia or any colorable imitation thereof, except when authorized under rules and regulations prescribed by any such organization, shall be fined under this title or imprisoned not more than six months, or both.(June 25, 1948, ch. 645, 62 Stat. 732; Aug. 4, 1950, ch. 578, 64 Stat. 413; Pub. L. 103–322, title XXXIII, §330016(1)(E), Sept. 13, 1994, 108 Stat. 2146.)Historical and Revision NotesBased on title 18, U.S.C., 1940 ed., §76e (June 25, 1940, ch. 426, 54 Stat. 571).Words beginning the section are from the punishment provision of last sentence which was itself rewritten without surplusage.Changes were made in phraseology.Editorial NotesAmendments1994-Pub. L. 103–322 substituted ""fined under this title"" for ""fined not more than $250"".1950-Act Aug. 4, 1950, brought within the protection of this section emblems, badges, or insignia of auxiliary organizations of veteran's organizations incorporated by an act of Congress.","Amendments1994-Pub. L. 103–322 substituted ""fined under this title"" for ""fined not more than $250"".1950-Act Aug. 4, 1950, brought within the protection of this section emblems, badges, or insignia of auxiliary organizations of veteran's organizations incorporated by an act of Congress."
706. Red Cross,https://uscode.house.gov/view.xhtml?req=granuleid:USC-prelim-title18-section706&num=0&edition=prelim,"Whoever wears or displays the sign of the Red Cross or any insignia colored in imitation thereof for the fraudulent purpose of inducing the belief that he is a member of or an agent for the American National Red Cross; orWhoever, whether a corporation, association or person, other than the American National Red Cross and its duly authorized employees and agents and the sanitary and hospital authorities of the armed forces of the United States, uses the emblem of the Greek red cross on a white ground, or any sign or insignia made or colored in imitation thereof or the words ""Red Cross"" or ""Geneva Cross"" or any combination of these words-Shall be fined under this title or imprisoned not more than six months, or both.This section shall not make unlawful the use of any such emblem, sign, insignia or words which was lawful on the date of enactment of this title.(June 25, 1948, ch. 645, 62 Stat. 732; May 24, 1949, ch. 139, §17, 63 Stat. 92; Pub. L. 103–322, title XXXIII, §330016(1)(E), Sept. 13, 1994, 108 Stat. 2146.)Historical and Revision Notes1948 ActBased on section 4 of title 36, Patriotic Societies and Observances (Jan. 5, 1905, ch. 23, §4, 33 Stat. 600; June 23, 1910, ch. 372, §1, 36 Stat. 604).False personation provision in first part of section was omitted here and incorporated in section 917 of this title.Words of punishment ""$250"" and ""six months"" were substituted for ""$500"" and ""one year"" respectively as more consonant with penalties provided for similar offenses in this chapter. (See sections 701, 704, 705 of this title.)Punishment provisions were also changed to omit reference to ""misdemeanor"" in view of definitive section 1 of this title.Words ""upon conviction thereof"" were omitted as surplusage, because punishment can only be imposed after conviction.Changes were made in phraseology.1949 ActThis section [section 17] clarifies the wording of section 706 of title 18, U.S.C., to embrace all service sanitary units whether belonging to the Army, Navy, Air Force, or other branches of the Armed services. (See note to sec. 5 [of 1949 Act, set out in Legislative History note under section 244 of title 18]).Editorial NotesReferences in TextThe date of enactment of this title, referred to in text, means June 25, 1948.Amendments1994-Pub. L. 103–322 substituted ""fined under this title"" for ""fined not more than $250"" in third par.1949-Act May 24, 1949, included all service sanitary units.","References in TextThe date of enactment of this title, referred to in text, means June 25, 1948.Amendments1994-Pub. L. 103–322 substituted ""fined under this title"" for ""fined not more than $250"" in third par.1949-Act May 24, 1949, included all service sanitary units."
706. a. Geneva distinctive emblems,https://uscode.house.gov/view.xhtml?req=granuleid:USC-prelim-title18-section706a&num=0&edition=prelim,"18 USC 706a: Geneva distinctive emblems            Result 1 of 1                                      Current2018 Ed. and Supplement V (1/3/2024)2018 Ed. and Supplement IV (1/5/2023)2018 Ed. and Supplement III (1/3/2022)2018 Ed. and Supplement II (1/13/2021)2018 Ed. and Supplement I (1/24/2020)2018 Main Ed. (1/14/2019)2012 Ed. and Supplement V (1/12/2018)2012 Ed. and Supplement IV (1/6/2017)2012 Ed. and Supplement III (1/3/2016)2012 Ed. and Supplement II (1/5/2015)2012 Ed. and Supplement I (1/16/2014)2012 Main Ed. (1/15/2013)2006 Ed. and Supplement V (1/3/2012)2006 Ed. and Supplement IV (1/7/2011)2006 Ed. and Supplement III (2/1/2010)2006 Ed. and Supplement II (1/5/2009)2006 Ed. and Supplement I (1/8/2008)2006 Main Ed. (1/3/2007)2000 Ed. and Supplement V (1/2/2006)2000 Ed. and Supplement IV (1/3/2005)2000 Ed. and Supplement III (1/19/2004)2000 Ed. and Supplement II (1/6/2003)2000 Ed. and Supplement I (1/22/2002)2000 Main Ed. (1/2/2001)1994 Ed. and Supplement V (1/23/2000)1994 Ed. and Supplement IV (1/5/1999)1994 Ed. and Supplement III (1/26/1998)1994 Ed. and Supplement II (1/6/1997)1994 Ed. and Supplement I (1/16/1996)1994 Main Ed. (1/4/1995)                         Back to Original Document << Previous                                 TITLE 18 / PART I / CHAPTER 33 / § 706a                                 Next >>[Print]                                  [Print selection][OLRC Home]Help 18 USC 706a: Geneva distinctive emblemsText contains those laws in effect on September 27, 2024From Title 18-CRIMES AND CRIMINAL PROCEDUREPART I-CRIMESCHAPTER 33-EMBLEMS, INSIGNIA, AND NAMESJump To: Source Credit§706a. Geneva distinctive emblems(a) Whoever wears or displays the sign of the Red Crescent or the Third Protocol Emblem (the Red Crystal), or any insignia colored in imitation thereof for the fraudulent purpose of inducing the belief that he is a member of or an agent for an authorized national society using the Red Crescent or the Third Protocol Emblem, the International Committee of the Red Cross, or the International Federation of Red Cross and Red Crescent Societies shall be fined under this title or imprisoned not more than 6 months, or both.(b) Except as set forth in section 1 (c) and (d), whoever, whether a corporation, association, or person, uses the emblem of the Red Crescent or the Third Protocol Emblem on a white ground or any sign or insignia made or colored in imitation thereof or the designations ""Red Crescent"" or ""Third Protocol Emblem"" shall be fined under this title or imprisoned not more than 6 months, or both.(c) The following may use such emblems and designations consistent with the Geneva Conventions of August 12, 1949, and, if applicable, the Additional Protocols:(1) Authorized national societies that are members of the International Federation of Red Cross and Red Crescent Societies and their duly authorized employees and agents.(2) The International Committee of the Red Cross and its duly authorized employees and agents.(3) The International Federation of Red Cross and Red Crescent Societies and its duly authorized employees and agents.(4) The sanitary and hospital authorities of the armed forces of State Parties to the Geneva Conventions of August 12, 1949.(d) This section does not make unlawful the use of any such emblem, sign, insignia, or words which was lawful on or before December 8, 2005, if such use would not appear in time of armed conflict to confer the protections of the Geneva Conventions of August 12, 1949, and, if applicable, the Additional Protocols.(e) A violation of this section or section 706 may be enjoined at the civil suit of the Attorney General.(Added Pub. L. 109–481, §2(a), Jan. 12, 2007, 120 Stat. 3673.)1 So in original. Probably should be ""subsections"".",
