Section,Url,Content,Metadata
71. —Front Matter,https://uscode.house.gov/view.xhtml?req=granuleid:USC-prelim-title18-chapter71-front&num=0&edition=prelim,"18 USC Ch. 71: Front Matter            Result 1 of 1                                      Current2018 Ed. and Supplement V (1/3/2024)2018 Ed. and Supplement IV (1/5/2023)2018 Ed. and Supplement III (1/3/2022)2018 Ed. and Supplement II (1/13/2021)2018 Ed. and Supplement I (1/24/2020)2018 Main Ed. (1/14/2019)2012 Ed. and Supplement V (1/12/2018)2012 Ed. and Supplement IV (1/6/2017)2012 Ed. and Supplement III (1/3/2016)2012 Ed. and Supplement II (1/5/2015)2012 Ed. and Supplement I (1/16/2014)2012 Main Ed. (1/15/2013)2006 Ed. and Supplement V (1/3/2012)2006 Ed. and Supplement IV (1/7/2011)2006 Ed. and Supplement III (2/1/2010)2006 Ed. and Supplement II (1/5/2009)2006 Ed. and Supplement I (1/8/2008)2006 Main Ed. (1/3/2007)2000 Ed. and Supplement V (1/2/2006)2000 Ed. and Supplement IV (1/3/2005)2000 Ed. and Supplement III (1/19/2004)2000 Ed. and Supplement II (1/6/2003)2000 Ed. and Supplement I (1/22/2002)2000 Main Ed. (1/2/2001)1994 Ed. and Supplement V (1/23/2000)1994 Ed. and Supplement IV (1/5/1999)1994 Ed. and Supplement III (1/26/1998)1994 Ed. and Supplement II (1/6/1997)1994 Ed. and Supplement I (1/16/1996)1994 Main Ed. (1/4/1995)                         Back to Original Document << Previous                                 TITLE 18 / PART I / CHAPTER 71 / Front Matter                                 Next >>[Print]                                  [Print selection][OLRC Home]Help 18 USC Ch. 71: Front MatterFrom Title 18-CRIMES AND CRIMINAL PROCEDUREPART I-CRIMESCHAPTER 71-OBSCENITYJump To: MiscellaneousAmendmentsCHAPTER 71-OBSCENITYSec.1460.Possession with intent to sell, and sale, of obscene matter on Federal property.1461.Mailing obscene or crime-inciting matter.1462.Importation or transportation of obscene matters.1463.Mailing indecent matter on wrappers or envelopes.1464.Broadcasting obscene language.1465.Transportation of obscene matters for sale or distribution.1        1466.Engaging in the business of selling or transferring obscene matter.1466A.Obscene visual representations of the sexual abuse of children.1467.Criminal forfeiture.1468.Distributing obscene material by cable or subscription television.1469.Presumptions.1470.Transfer of obscene material to minors.        Editorial NotesAmendments2003-Pub. L. 108–21, title V, §504(b), Apr. 30, 2003, 117 Stat. 682, added item 1466A.1998-Pub. L. 105–314, title IV, §401(b), Oct. 30, 1998, 112 Stat. 2979, added item 1470.1988-Pub. L. 100–690, title VII, §§7521(b), (f)[(e)], 7523(b), 7526(b), Nov. 18, 1988, 102 Stat. 4489, 4490, 4502, 4503, added items 1460 and 1466 to 1469.1955-Act June 28, 1955, ch. 190, §4, 69 Stat. 184, added item 1465.1950-Act May 27, 1950, ch. 214, §2, 64 Stat. 194, substituted ""matters"" for ""literature"" in item 1462.1 Section catchline amended by Pub. L. 109–248 without corresponding amendment of chapter analysis.","Amendments2003-Pub. L. 108–21, title V, §504(b), Apr. 30, 2003, 117 Stat. 682, added item 1466A.1998-Pub. L. 105–314, title IV, §401(b), Oct. 30, 1998, 112 Stat. 2979, added item 1470.1988-Pub. L. 100–690, title VII, §§7521(b), (f)[(e)], 7523(b), 7526(b), Nov. 18, 1988, 102 Stat. 4489, 4490, 4502, 4503, added items 1460 and 1466 to 1469.1955-Act June 28, 1955, ch. 190, §4, 69 Stat. 184, added item 1465.1950-Act May 27, 1950, ch. 214, §2, 64 Stat. 194, substituted ""matters"" for ""literature"" in item 1462.1 Section catchline amended by Pub. L. 109–248 without corresponding amendment of chapter analysis."
"1460. Possession with intent to sell, and sale, of obscene matter on Federal property",https://uscode.house.gov/view.xhtml?req=granuleid:USC-prelim-title18-section1460&num=0&edition=prelim,"(a) Whoever, either-(1) in the special maritime and territorial jurisdiction of the United States, or on any land or building owned by, leased to, or otherwise used by or under the control of the Government of the United States; or(2) in the Indian country as defined in section 1151 of this title,knowingly sells or possesses with intent to sell an obscene visual depiction shall be punished by a fine in accordance with the provisions of this title or imprisoned for not more than 2 years, or both.(b) For the purposes of this section, the term ""visual depiction"" includes undeveloped film and videotape but does not include mere words.(Added Pub. L. 100–690, title VII, §7526(a), Nov. 18, 1988, 102 Stat. 4503; amended Pub. L. 101–647, title III, §323(c), Nov. 29, 1990, 104 Stat. 4819.)Editorial NotesAmendments1990-Subsec. (a). Pub. L. 101–647, §323(c)(1), struck out ""or a visual depiction of a minor engaging in or assisting another person to engage in sexually explicit conduct,"" after ""visual depiction"" in concluding provisions.Subsec. (b). Pub. L. 101–647, §323(c)(2), amended subsec. (b) generally. Prior to amendment, subsec. (b) read as follows: ""For the purposes of this section-""(1) the term 'visual depiction' includes undeveloped film and videotape but does not include mere words; and""(2) the terms 'minor' and 'sexually explicit conduct' have the meaning given those terms in chapter 110 of this title.""","Amendments1990-Subsec. (a). Pub. L. 101–647, §323(c)(1), struck out ""or a visual depiction of a minor engaging in or assisting another person to engage in sexually explicit conduct,"" after ""visual depiction"" in concluding provisions.Subsec. (b). Pub. L. 101–647, §323(c)(2), amended subsec. (b) generally. Prior to amendment, subsec. (b) read as follows: ""For the purposes of this section-""(1) the term 'visual depiction' includes undeveloped film and videotape but does not include mere words; and""(2) the terms 'minor' and 'sexually explicit conduct' have the meaning given those terms in chapter 110 of this title."""
1461. Mailing obscene or crime-inciting matter,https://uscode.house.gov/view.xhtml?req=granuleid:USC-prelim-title18-section1461&num=0&edition=prelim,"Every obscene, lewd, lascivious, indecent, filthy or vile article, matter, thing, device, or substance; and-Every article or thing designed, adapted, or intended for producing abortion, or for any indecent or immoral use; andEvery article, instrument, substance, drug, medicine, or thing which is advertised or described in a manner calculated to lead another to use or apply it for producing abortion, or for any indecent or immoral purpose; andEvery written or printed card, letter, circular, book, pamphlet, advertisement, or notice of any kind giving information, directly or indirectly, where, or how, or from whom, or by what means any of such mentioned matters, articles, or things may be obtained or made, or where or by whom any act or operation of any kind for the procuring or producing of abortion will be done or performed, or how or by what means abortion may be produced, whether sealed or unsealed; andEvery paper, writing, advertisement, or representation that any article, instrument, substance, drug, medicine, or thing may, or can, be used or applied for producing abortion, or for any indecent or immoral purpose; andEvery description calculated to induce or incite a person to so use or apply any such article, instrument, substance, drug, medicine, or thing-Is declared to be nonmailable matter and shall not be conveyed in the mails or delivered from any post office or by any letter carrier.Whoever knowingly uses the mails for the mailing, carriage in the mails, or delivery of anything declared by this section or section 3001(e) of title 39 to be nonmailable, or knowingly causes to be delivered by mail according to the direction thereon, or at the place at which it is directed to be delivered by the person to whom it is addressed, or knowingly takes any such thing from the mails for the purpose of circulating or disposing thereof, or of aiding in the circulation or disposition thereof, shall be fined under this title or imprisoned not more than five years, or both, for the first such offense, and shall be fined under this title or imprisoned not more than ten years, or both, for each such offense thereafter.The term ""indecent"", as used in this section includes matter of a character tending to incite arson, murder, or assassination.(June 25, 1948, ch. 645, 62 Stat. 768; June 28, 1955, ch. 190, §§1, 2, 69 Stat. 183; Pub. L. 85–796, §1, Aug. 28, 1958, 72 Stat. 962; Pub. L. 91–662, §§3, 5(b), 6(3), Jan. 8, 1971, 84 Stat. 1973, 1974; Pub. L. 103–322, title XXXIII, §330016(1)(K), (L), Sept. 13, 1994, 108 Stat. 2147.)Historical and Revision NotesBased on title 18, U.S.C., 1940 ed., §334 (Mar. 4, 1909, ch. 321, §211, 35 Stat. 1429 [1129]; Mar. 4, 1911, ch. 241, §2, 36 Stat. 1339).The attention of Congress is invited to the following decisions of the Federal courts construing this section and section 1462 of this title.In Youngs Rubber Corporation, Inc. v. C. I. Lee & Co., Inc., C.C.A. 1930, 45 F. 2d 103, it was said that the word ""adapted"" as used in this section and in section 1462 of this title, the latter relating to importation and transportation of obscene matter, is not to be construed literally, the more reasonable interpretation being to construe the whole phrase ""designed, adapted or intended"" as requiring ""an intent on the part of the sender that the article mailed or shipped by common carrier be used for illegal contraception or abortion or for indecent or immoral purposes."" The court pointed out that, taken literally, the language of these sections would seem to forbid the transportation by mail or common carrier of anything ""adapted,"" in the sense of being suitable or fitted, for preventing conception or for any indecent or immoral purpose, ""even though the article might also be capable of legitimate uses and the sender in good faith supposed that it would be used only legitimately. Such a construction would prevent mailing to or by a physician of any drug or mechanical device 'adapted' for contraceptive or abortifacient uses, although the physician desired to use or to prescribe it for proper medical purposes. The intention to prevent a proper medical use of drugs or other articles merely because they are capable of illegal uses is not lightly to be ascribed to Congress. Section 334 [this section] forbids also the mailing of obscene books and writings; yet it has never been thought to bar from the mails medical writings sent to or by physicians for proper purposes, though of a character which would render them highly indecent if sent broadcast to all classes of persons."" In United States v. Nicholas, C.C.A. 1938, 97 F. 2d 510, ruling directly on this point, it was held that the importation or sending through the mails of contraceptive articles or publications is not forbidden absolutely, but only when such articles or publications are unlawfully employed. The same rule was followed in Davis v. United States, C.C.A. 1933, 62 F. 2d 473, quoting the obiter opinion from Youngs Rubber Corporation v. C. I. Lee & Co., supra, and holding that the intent of the person mailing a circular conveying information for preventing conception that the article described therein should be used for condemned purposes was necessary for a conviction; also that this section must be given a reasonable construction. (See also United States v. One Package, C.C.A. 1936, 86 F. 2d 737.)Reference to persons causing or procuring was omitted as unnecessary in view of definition of ""principal"" in section 2 of this title.Minor changes in phraseology were made.Editorial NotesAmendments1994-Pub. L. 103–322, in eighth par., substituted ""fined under this title"" for ""fined not more than $5,000"" after ""thereof, shall be"" and for ""fined not more than $10,000"" after ""offense, and shall be"".1971-Pub. L. 91–662, §3(1), in second par., struck out ""preventing conception or"" before ""producing abortion"".Pub. L. 91–662, §3(1), in third par., struck out ""preventing conception or"" after ""apply it for"".Pub. L. 91–662, §3(2), (3), in fourth par., substituted ""means abortion may be produced"" for ""means conception may be prevented or abortion produced"".Pub. L. 91–662, §3(1), in fifth par., struck out ""preventing conception or"" after ""applied for"".Pub. L. 91–662, §6(3), in eighth par., inserted ""or section 3001(e) of title 39"" after ""this section"". Section 5(b) of Pub. L. 91–662 inserted reference to section 4001(d) of Title 39, The Postal Service, which reflected provisions of Title 39 prior to the effective date of Title 39, Postal Service, as enacted by the Postal Reorganization Act. Said section 4001(d) was repealed by section 6(2) of Pub. L. 91–662, effective on the date that the Board of Governors of the Postal Service establish as the effective date for section 3001 of Title 39, Postal Service.1958-Pub. L. 85–796 provided in eighth par. for continuing offenses by use of the mails instead of by deposits for mailing and for punishment for subsequent offenses.1955-Act June 28, 1955, §1, in first par., substituted ""indecent, filthy or vile article, matter, thing, device or substance"" for ""or filthy book, pamphlet, picture paper, letter, writing, print, or other publication of an indecent character"".Act June 28, 1955, §2, struck out fifth par., which read as follows: ""Every letter, packet, or package, or other mail matter containing any filthy, vile, or indecent thing, device or substance; and"".Statutory Notes and Related SubsidiariesEffective Date of 1971 AmendmentAmendment by sections 3 and 5(b) of Pub. L. 91–662 effective Jan. 9, 1971, see section 7 of Pub. L. 91–662, set out as a note under section 552 of this title.Pub. L. 91–662, §6, Jan. 8, 1971, 84 Stat. 1974, provided that the amendment made by that section is effective on date that Board of Governors of United States Postal Service establishes as the effective date for section 3001 of title 39 of the United States Code, as enacted by the Postal Reorganization Act.Commission on Obscenity and PornographyPub. L. 90–100, Oct. 3, 1967, 81 Stat. 253, as amended by Pub. L. 90–350, title V, §502, June 19, 1968, 82 Stat. 197; Pub. L. 91–74, title V, §503, Sept. 29, 1969, 83 Stat. 123, provided for establishment of Commission on Obscenity and Pornography, its membership, compensation of members, powers, functions, and duties of Commission, required Commission to report to President and to Congress its findings and recommendations no later than Sept. 30, 1970, and provided for its termination ten days following submission of report.","Amendments1994-Pub. L. 103–322, in eighth par., substituted ""fined under this title"" for ""fined not more than $5,000"" after ""thereof, shall be"" and for ""fined not more than $10,000"" after ""offense, and shall be"".1971-Pub. L. 91–662, §3(1), in second par., struck out ""preventing conception or"" before ""producing abortion"".Pub. L. 91–662, §3(1), in third par., struck out ""preventing conception or"" after ""apply it for"".Pub. L. 91–662, §3(2), (3), in fourth par., substituted ""means abortion may be produced"" for ""means conception may be prevented or abortion produced"".Pub. L. 91–662, §3(1), in fifth par., struck out ""preventing conception or"" after ""applied for"".Pub. L. 91–662, §6(3), in eighth par., inserted ""or section 3001(e) of title 39"" after ""this section"". Section 5(b) of Pub. L. 91–662 inserted reference to section 4001(d) of Title 39, The Postal Service, which reflected provisions of Title 39 prior to the effective date of Title 39, Postal Service, as enacted by the Postal Reorganization Act. Said section 4001(d) was repealed by section 6(2) of Pub. L. 91–662, effective on the date that the Board of Governors of the Postal Service establish as the effective date for section 3001 of Title 39, Postal Service.1958-Pub. L. 85–796 provided in eighth par. for continuing offenses by use of the mails instead of by deposits for mailing and for punishment for subsequent offenses.1955-Act June 28, 1955, §1, in first par., substituted ""indecent, filthy or vile article, matter, thing, device or substance"" for ""or filthy book, pamphlet, picture paper, letter, writing, print, or other publication of an indecent character"".Act June 28, 1955, §2, struck out fifth par., which read as follows: ""Every letter, packet, or package, or other mail matter containing any filthy, vile, or indecent thing, device or substance; and"".Statutory Notes and Related SubsidiariesEffective Date of 1971 AmendmentAmendment by sections 3 and 5(b) of Pub. L. 91–662 effective Jan. 9, 1971, see section 7 of Pub. L. 91–662, set out as a note under section 552 of this title.Pub. L. 91–662, §6, Jan. 8, 1971, 84 Stat. 1974, provided that the amendment made by that section is effective on date that Board of Governors of United States Postal Service establishes as the effective date for section 3001 of title 39 of the United States Code, as enacted by the Postal Reorganization Act.Commission on Obscenity and PornographyPub. L. 90–100, Oct. 3, 1967, 81 Stat. 253, as amended by Pub. L. 90–350, title V, §502, June 19, 1968, 82 Stat. 197; Pub. L. 91–74, title V, §503, Sept. 29, 1969, 83 Stat. 123, provided for establishment of Commission on Obscenity and Pornography, its membership, compensation of members, powers, functions, and duties of Commission, required Commission to report to President and to Congress its findings and recommendations no later than Sept. 30, 1970, and provided for its termination ten days following submission of report."
1462. Importation or transportation of obscene matters,https://uscode.house.gov/view.xhtml?req=granuleid:USC-prelim-title18-section1462&num=0&edition=prelim,"Whoever brings into the United States, or any place subject to the jurisdiction thereof, or knowingly uses any express company or other common carrier or interactive computer service (as defined in section 230(e)(2) 1 of the Communications Act of 1934), for carriage in interstate or foreign commerce-(a) any obscene, lewd, lascivious, or filthy book, pamphlet, picture, motion-picture film, paper, letter, writing, print, or other matter of indecent character; or(b) any obscene, lewd, lascivious, or filthy phonograph recording, electrical transcription, or other article or thing capable of producing sound; or(c) any drug, medicine, article, or thing designed, adapted, or intended for producing abortion, or for any indecent or immoral use; or any written or printed card, letter, circular, book, pamphlet, advertisement, or notice of any kind giving information, directly or indirectly, where, how, or of whom, or by what means any of such mentioned articles, matters, or things may be obtained or made; orWhoever knowingly takes or receives, from such express company or other common carrier or interactive computer service (as defined in section 230(e)(2) 1 of the Communications Act of 1934) any matter or thing the carriage or importation of which is herein made unlawful-Shall be fined under this title or imprisoned not more than five years, or both, for the first such offense and shall be fined under this title or imprisoned not more than ten years, or both, for each such offense thereafter.(June 25, 1948, ch. 645, 62 Stat. 768; May 27, 1950, ch. 214, §1, 64 Stat. 194; Pub. L. 85–796, §2, Aug. 28, 1958, 72 Stat. 962; Pub. L. 91–662, §4, Jan. 8, 1971, 84 Stat. 1973; Pub. L. 103–322, title XXXIII, §330016(1)(K), (L), Sept. 13, 1994, 108 Stat. 2147; Pub. L. 104–104, title V, §507(a), Feb. 8, 1996, 110 Stat. 137.)Historical and Revision NotesBased on title 18, U.S.C., 1940 ed., §396 (Mar. 4, 1909, ch. 321, §245, 35 Stat. 1138; June 5, 1920, ch. 268, 41 Stat. 1060).Reference to persons causing or procuring was omitted as unnecessary in view of definition of ""principal"" in section 2 of this title.Words ""in interstate or foreign commerce"" were substituted for ten lines of text without loss of meaning. (See definitive section 10 of this title.)(See reviser's note under section 1461 of this title.)Minor changes in phraseology were made.Editorial NotesReferences in TextSection 230(e)(2) of the Communications Act of 1934, referred to in text, was redesignated section 230(f)(2) of the Communications Act of 1934 by Pub. L. 105–277, div. C, title XIV, §1404(a)(2), Oct. 21, 1998, 112 Stat. 2681–739, and is classified to section 230(f)(2) of Title 47, Telecommunications.Amendments1996-Pub. L. 104–104, §507(a)(1), inserted ""or interactive computer service (as defined in section 230(e)(2) of the Communications Act of 1934)"" after ""carrier"" in first par.Pub. L. 104–104, §507(a)(2), in second par., inserted ""or receives,"" after ""takes"", ""or interactive computer service (as defined in section 230(e)(2) of the Communications Act of 1934)"" after ""common carrier"", and ""or importation"" after ""carriage"".1994-Pub. L. 103–322, in last par., substituted ""fined under this title"" for ""fined not more than $5,000"" after ""Shall be"" and for ""fined not more than $10,000"" after ""and shall be"".1971-Pub. L. 91–662 struck out ""preventing conception, or"" before ""producing abortion"".1958-Pub. L. 85–796 substituted ""uses"" for ""deposits with"" in opening par., ""carriage of which"" for ""depositing of which for carriage"" in penultimate par., and inserted penalty provisions for subsequent offenses in last par.1950-Act May 27, 1950, brought within scope of section the importation or transportation of any obscene, lewd, lascivious, or filthy phonograph recording, electrical transcription, or other article or think capable of producing sound.Statutory Notes and Related SubsidiariesEffective Date of 1971 AmendmentAmendment by Pub. L. 91–662 effective Jan. 9, 1971, see section 7 of Pub. L. 91–662, set out as a note under section 552 of this title.Construction of 1996 AmendmentPub. L. 104–104, title V, §507(c), Feb. 8, 1996, 110 Stat. 137, provided that: ""The amendments made by this section [amending this section and section 1465 of this title] are clarifying and shall not be interpreted to limit or repeal any prohibition contained in sections 1462 and 1465 of title 18, United States Code, before such amendment, under the rule established in United States v. Alpers, 338 U.S. 680 (1950).""1 See References in Text note below.","References in TextSection 230(e)(2) of the Communications Act of 1934, referred to in text, was redesignated section 230(f)(2) of the Communications Act of 1934 by Pub. L. 105–277, div. C, title XIV, §1404(a)(2), Oct. 21, 1998, 112 Stat. 2681–739, and is classified to section 230(f)(2) of Title 47, Telecommunications.Amendments1996-Pub. L. 104–104, §507(a)(1), inserted ""or interactive computer service (as defined in section 230(e)(2) of the Communications Act of 1934)"" after ""carrier"" in first par.Pub. L. 104–104, §507(a)(2), in second par., inserted ""or receives,"" after ""takes"", ""or interactive computer service (as defined in section 230(e)(2) of the Communications Act of 1934)"" after ""common carrier"", and ""or importation"" after ""carriage"".1994-Pub. L. 103–322, in last par., substituted ""fined under this title"" for ""fined not more than $5,000"" after ""Shall be"" and for ""fined not more than $10,000"" after ""and shall be"".1971-Pub. L. 91–662 struck out ""preventing conception, or"" before ""producing abortion"".1958-Pub. L. 85–796 substituted ""uses"" for ""deposits with"" in opening par., ""carriage of which"" for ""depositing of which for carriage"" in penultimate par., and inserted penalty provisions for subsequent offenses in last par.1950-Act May 27, 1950, brought within scope of section the importation or transportation of any obscene, lewd, lascivious, or filthy phonograph recording, electrical transcription, or other article or think capable of producing sound.Statutory Notes and Related SubsidiariesEffective Date of 1971 AmendmentAmendment by Pub. L. 91–662 effective Jan. 9, 1971, see section 7 of Pub. L. 91–662, set out as a note under section 552 of this title.Construction of 1996 AmendmentPub. L. 104–104, title V, §507(c), Feb. 8, 1996, 110 Stat. 137, provided that: ""The amendments made by this section [amending this section and section 1465 of this title] are clarifying and shall not be interpreted to limit or repeal any prohibition contained in sections 1462 and 1465 of title 18, United States Code, before such amendment, under the rule established in United States v. Alpers, 338 U.S. 680 (1950).""1 See References in Text note below."
