Section,Url,Content,Metadata
1906. Disclosure of information from a bank examination report,https://uscode.house.gov/view.xhtml?req=granuleid:USC-prelim-title18-section1906&num=0&edition=prelim,"Whoever, being an examiner, public or private, or a Government Accountability Office employee with access to bank examination report information under section 714 of title 31, discloses the names of borrowers or the collateral for loans of any member bank of the Federal Reserve System, any bank insured by the Federal Deposit Insurance Corporation, any branch or agency of a foreign bank (as such terms are defined in paragraphs (1) and (3) of section 1(b) of the International Banking Act of 1978), or any organization operating under section 25 or section 25(a) 1 of the Federal Reserve Act, examined by him or subject to Government Accountability Office audit under section 714 of title 31 to other than the proper officers of such bank, branch, agency, or organization, without first having obtained the express permission in writing from the Comptroller of the Currency as to a national bank or a Federal branch or Federal agency (as such terms are defined in paragraphs (5) and (6) of section 1(b) of the International Banking Act of 1978), the Board of Governors of the Federal Reserve System as to a State member bank, an uninsured State branch or State agency (as such terms are defined in paragraphs (11) and (12) of section 1(b) of the International Banking Act of 1978), or an organization operating under section 25 or section 25(a) 1 of the Federal Reserve Act, or the Federal Deposit Insurance Corporation as to any other insured bank, including any insured branch (as defined in section 3(s) of the Federal Deposit Insurance Act),,2 or from the board of directors of such bank or organization, except when ordered to do so by a court of competent jurisdiction, or by direction of the Congress of the United States, or either House thereof, or any committee of Congress or either House duly authorized or as authorized by section 714 of title 31 shall be fined under this title or imprisoned not more than one year or both.(June 25, 1948, ch. 645, 62 Stat. 791; Pub. L. 95–320, §3, July 21, 1978, 92 Stat. 393; Pub. L. 97–258, §3(e)(1), Sept. 13, 1982, 96 Stat. 1064; Pub. L. 101–647, title XXV, §2597(k), Nov. 29, 1990, 104 Stat. 4911; Pub. L. 103–322, title XXXIII, §330016(1)(K), Sept. 13, 1994, 108 Stat. 2147; Pub. L. 108–271, §8(b), July 7, 2004, 118 Stat. 814.)Historical and Revision NotesBased on section 594 of title 12, U.S.C., 1940 ed., Banks and Banking (Dec. 23, 1913, ch. 6, §22 [second and third sentences of second paragraph], 38 Stat. 272, 273; Sept. 26, 1918, ch. 177, §5 [22(b), second paragraph], 40 Stat. 970; Aug. 23, 1935, ch. 614, §326(b), 49 Stat. 716).Other provisions of section 594 of title 12, U.S.C., 1940 ed., Banks and Banking, were consolidated with similar provisions from other sections, to form section 1909 of this title.Changes were made in phraseology.Editorial NotesReferences in TextSection 1(b) of the International Banking Act of 1978, referred to in text, is classified to section 3101 of Title 12, Banks and Banking.Section 25 of the Federal Reserve Act, referred to in text, is classified to subchapter I (§601 et seq.) of chapter 6 of Title 12. Section 25(a) of the Federal Reserve Act, which is classified to subchapter II (§611 et seq.) of chapter 6 of Title 12, was renumbered section 25A of that act by Pub. L. 102–242, title I, §142(e)(2), Dec. 19, 1991, 105 Stat. 2281.Section 3(s) of the Federal Deposit Insurance Act, referred to in text, is classified to section 1813(s) of Title 12.Amendments2004-Pub. L. 108–271 substituted ""Government Accountability Office"" for ""General Accounting Office"" in two places.1994-Pub. L. 103–322 substituted ""fined under this title"" for ""fined not more than $5,000"".1990-Pub. L. 101–647 substituted ""System, any bank insured"" for ""System, or bank insured"" and inserted "", any branch or agency of a foreign bank (as such terms are defined in paragraphs (1) and (3) of section 1(b) of the International Banking Act of 1978), or any organization operating under section 25 or section 25(a) of the Federal Reserve Act,"" after ""by the Federal Deposit Insurance Corporation"", ""branch, agency, or organization,"" after ""proper officers of such bank,"", ""or a Federal branch or Federal agency (as such terms are defined in paragraphs (5) and (6) of section 1(b) of the International Banking Act of 1978)"" after ""national bank"", "", an uninsured State branch or State agency (as such terms are defined in paragraphs (11) and (12) of section 1(b) of the International Banking Act of 1978), or an organization operating under section 25 or section 25(a) of the Federal Reserve Act"" after ""as to a State member bank"", "", including any insured branch (as defined in section 3(s) of the Federal Deposit Insurance Act),"" after ""any other insured bank"", and ""or organization"" after ""board of directors of such bank"".1982-Pub. L. 97–258 substituted ""section 714 of title 31"" for ""section 117(e) of the Accounting and Auditing Act of 1950"" wherever appearing.1978-Pub. L. 95–320 substituted ""from a bank examination report"" for ""by bank examiner"" in section catchline and, in text, substituted ""public or private, or a General Accounting Office employee with access to bank examination report information under section 117(e) of the Accounting and Auditing Act of 1950, discloses"" for ""public or private, discloses"", ""examined by him or subject to General Accounting Office audit under section 117(e) of the Accounting and Auditing Act of 1950 to other than"" for "", examined by him, to other than"", and ""either House duly authorized or as authorized by section 117(e) of the Accounting and Auditing Act of 1950 shall be fined"" for ""either House duly authorized, shall be fined"".Executive DocumentsException as to Transfer of FunctionsFunctions vested by any provision of law in Comptroller of the Currency, referred to in this section, were not included in transfer of functions of officers, agencies, and employees of Department of the Treasury to Secretary of the Treasury, made by Reorg. Plan No. 26, of 1950, §1, eff. July 31, 1950, 15 F.R. 4935, 64 Stat. 1280, set out in the Appendix to Title 5, Government Organization and Employees.1 See References in Text note below.2 So in original.","References in TextSection 1(b) of the International Banking Act of 1978, referred to in text, is classified to section 3101 of Title 12, Banks and Banking.Section 25 of the Federal Reserve Act, referred to in text, is classified to subchapter I (§601 et seq.) of chapter 6 of Title 12. Section 25(a) of the Federal Reserve Act, which is classified to subchapter II (§611 et seq.) of chapter 6 of Title 12, was renumbered section 25A of that act by Pub. L. 102–242, title I, §142(e)(2), Dec. 19, 1991, 105 Stat. 2281.Section 3(s) of the Federal Deposit Insurance Act, referred to in text, is classified to section 1813(s) of Title 12.Amendments2004-Pub. L. 108–271 substituted ""Government Accountability Office"" for ""General Accounting Office"" in two places.1994-Pub. L. 103–322 substituted ""fined under this title"" for ""fined not more than $5,000"".1990-Pub. L. 101–647 substituted ""System, any bank insured"" for ""System, or bank insured"" and inserted "", any branch or agency of a foreign bank (as such terms are defined in paragraphs (1) and (3) of section 1(b) of the International Banking Act of 1978), or any organization operating under section 25 or section 25(a) of the Federal Reserve Act,"" after ""by the Federal Deposit Insurance Corporation"", ""branch, agency, or organization,"" after ""proper officers of such bank,"", ""or a Federal branch or Federal agency (as such terms are defined in paragraphs (5) and (6) of section 1(b) of the International Banking Act of 1978)"" after ""national bank"", "", an uninsured State branch or State agency (as such terms are defined in paragraphs (11) and (12) of section 1(b) of the International Banking Act of 1978), or an organization operating under section 25 or section 25(a) of the Federal Reserve Act"" after ""as to a State member bank"", "", including any insured branch (as defined in section 3(s) of the Federal Deposit Insurance Act),"" after ""any other insured bank"", and ""or organization"" after ""board of directors of such bank"".1982-Pub. L. 97–258 substituted ""section 714 of title 31"" for ""section 117(e) of the Accounting and Auditing Act of 1950"" wherever appearing.1978-Pub. L. 95–320 substituted ""from a bank examination report"" for ""by bank examiner"" in section catchline and, in text, substituted ""public or private, or a General Accounting Office employee with access to bank examination report information under section 117(e) of the Accounting and Auditing Act of 1950, discloses"" for ""public or private, discloses"", ""examined by him or subject to General Accounting Office audit under section 117(e) of the Accounting and Auditing Act of 1950 to other than"" for "", examined by him, to other than"", and ""either House duly authorized or as authorized by section 117(e) of the Accounting and Auditing Act of 1950 shall be fined"" for ""either House duly authorized, shall be fined"".Executive DocumentsException as to Transfer of FunctionsFunctions vested by any provision of law in Comptroller of the Currency, referred to in this section, were not included in transfer of functions of officers, agencies, and employees of Department of the Treasury to Secretary of the Treasury, made by Reorg. Plan No. 26, of 1950, §1, eff. July 31, 1950, 15 F.R. 4935, 64 Stat. 1280, set out in the Appendix to Title 5, Government Organization and Employees.1 See References in Text note below.2 So in original."
1907. Disclosure of information by farm credit examiner,https://uscode.house.gov/view.xhtml?req=granuleid:USC-prelim-title18-section1907&num=0&edition=prelim,"Whoever, being a farm credit examiner or any examiner, public or private, discloses the names of borrowers of any Federal land bank association or Federal land bank, or any organization examined by him under the provisions of law relating to Federal intermediate credit banks, to other than the proper officers of such institution or organization, without first having obtained express permission in writing from the Land Bank Commissioner or from the board of directors of such institution or organization, except when ordered to do so by a court of competent jurisdiction or by direction of the Congress of the United States or either House thereof, or any committee of Congress or either House duly authorized, shall be fined under this title or imprisoned not more than one year, or both; and shall be disqualified from holding office as a farm credit examiner.(June 25, 1948, ch. 645, 62 Stat. 791; Pub. L. 86–168, title I, §104(h), Aug. 18, 1959, 73 Stat. 387; Pub. L. 97–297, §4(c), Oct. 12, 1982, 96 Stat. 1318; Pub. L. 103–322, title XXXIII, §330016(1)(K), Sept. 13, 1994, 108 Stat. 2147.)Historical and Revision NotesBased on sections 983 and 1124 of title 12, U.S.C., 1940 ed., Banks and Banking (July 17, 1916, ch. 245, §31 [third and fourth sentences of third paragraph], 39 Stat. 383; July 17, 1916, ch. 245, §211(d) [part of first sentence], as added Mar. 4, 1923, ch. 252, §2, 42 Stat. 1460; June 16, 1933, ch. 98, §80(a), 48 Stat. 273).Section 983 of title 12, U.S.C., 1940 ed., Banks and Banking, does not include the term ""farm credit examiner,"" as used in this section, but it relates thereto as is indicated by sections 951 and 952 of said title.Section 1124 of title 12, U.S.C., 1940 ed., Banks and Banking, which was taken from a chapter in that title dealing with Federal intermediate credit banks, also relates to farm credit examiners as is indicated by section 1093 thereof. Even so, it was deemed advisable to retain the reference to any examiner ""public or private,"" as used in said section 1124.For clarification, the types of associations, banks, and organizations to which section relates, were enumerated wherever referred to, and words ""examined by him under the provisions of law relating to Federal intermediate credit banks"" were inserted.In addition, changes were made in phraseology.The provisions relating to disqualification from holding office as an incident to violation were contained in section 1124 of title 12, U.S.C., 1940 ed., Banks and Banking.For bribery and other provisions of section 1124 of title 12, U.S.C., 1940 ed., Banks and Banking, see sections 218 and 1909 of this title.Other provisions of said section 983 of title 12, U.S.C., 1940 ed., were incorporated in section 221 of this title.Editorial NotesAmendments1994-Pub. L. 103–322 substituted ""fined under this title"" for ""fined not more than $5,000"".1982-Pub. L. 97–297 substituted ""or Federal land bank"" for "", Federal land bank, or joint-stock land bank"".1959-Pub. L. 86–168 substituted ""Federal land bank associations"" for ""national farm loan association"".Statutory Notes and Related SubsidiariesEffective Date of 1959 AmendmentAmendment by Pub. L. 86–168 effective Dec. 31, 1959, see section 104(k) of Pub. L. 86–168.Abolition of Office of Land Bank CommissionerThe office of Land Bank Commissioner was abolished by section 636f of Title 12, Banks and Banking.","Amendments1994-Pub. L. 103–322 substituted ""fined under this title"" for ""fined not more than $5,000"".1982-Pub. L. 97–297 substituted ""or Federal land bank"" for "", Federal land bank, or joint-stock land bank"".1959-Pub. L. 86–168 substituted ""Federal land bank associations"" for ""national farm loan association"".Statutory Notes and Related SubsidiariesEffective Date of 1959 AmendmentAmendment by Pub. L. 86–168 effective Dec. 31, 1959, see section 104(k) of Pub. L. 86–168.Abolition of Office of Land Bank CommissionerThe office of Land Bank Commissioner was abolished by section 636f of Title 12, Banks and Banking."
"1908. Repealed. Pub. L. 103-322, title XXXIII, §330004(11), Sept. 13, 1994, 108 Stat. 2141",https://uscode.house.gov/view.xhtml?req=granuleid:USC-prelim-title18-section1908&num=0&edition=prelim,"18 USC 1908: Repealed. Pub. L. 103-322, title XXXIII, §330004(11), Sept. 13, 1994, 108 Stat. 2141            Result 1 of 1                                      Current2018 Ed. and Supplement V (1/3/2024)2018 Ed. and Supplement IV (1/5/2023)2018 Ed. and Supplement III (1/3/2022)2018 Ed. and Supplement II (1/13/2021)2018 Ed. and Supplement I (1/24/2020)2018 Main Ed. (1/14/2019)2012 Ed. and Supplement V (1/12/2018)2012 Ed. and Supplement IV (1/6/2017)2012 Ed. and Supplement III (1/3/2016)2012 Ed. and Supplement II (1/5/2015)2012 Ed. and Supplement I (1/16/2014)2012 Main Ed. (1/15/2013)2006 Ed. and Supplement V (1/3/2012)2006 Ed. and Supplement IV (1/7/2011)2006 Ed. and Supplement III (2/1/2010)2006 Ed. and Supplement II (1/5/2009)2006 Ed. and Supplement I (1/8/2008)2006 Main Ed. (1/3/2007)2000 Ed. and Supplement V (1/2/2006)2000 Ed. and Supplement IV (1/3/2005)2000 Ed. and Supplement III (1/19/2004)2000 Ed. and Supplement II (1/6/2003)2000 Ed. and Supplement I (1/22/2002)2000 Main Ed. (1/2/2001)1994 Ed. and Supplement V (1/23/2000)1994 Ed. and Supplement IV (1/5/1999)1994 Ed. and Supplement III (1/26/1998)1994 Ed. and Supplement II (1/6/1997)1994 Ed. and Supplement I (1/16/1996)1994 Main Ed. (1/4/1995)                         Back to Original Document << Previous                                 TITLE 18 / PART I / CHAPTER 93 / § 1908                                 Next >>[Print]                                  [Print selection][OLRC Home]Help 18 USC 1908: Repealed. Pub. L. 103-322, title XXXIII, §330004(11), Sept. 13, 1994, 108 Stat. 2141Text contains those laws in effect on September 28, 2024From Title 18-CRIMES AND CRIMINAL PROCEDUREPART I-CRIMESCHAPTER 93-PUBLIC OFFICERS AND EMPLOYEES[§1908. Repealed. Pub. L. 103–322, title XXXIII, §330004(11), Sept. 13, 1994, 108 Stat. 2141]Section, acts June 25, 1948, ch. 645, 62 Stat. 792; Sept. 13, 1994, Pub. L. 103–322, title XXXIII, §330016(1)(K), 108 Stat. 2147, related to disclosure of information by National Agricultural Credit Corporation examiner.",
1909. Examiner performing other services,https://uscode.house.gov/view.xhtml?req=granuleid:USC-prelim-title18-section1909&num=0&edition=prelim,"Whoever, being a national-bank examiner, Federal Deposit Insurance Corporation examiner, or farm credit examiner, performs any other service, for compensation, for any bank or banking or loan association, or for any officer, director, or employee thereof, or for any person connected therewith in any capacity, shall be fined under this title or imprisoned not more than one year, or both.(June 25, 1948, ch. 645, 62 Stat. 792; Pub. L. 103–322, title XXXIII, §§330004(12), 330016(1)(K), Sept. 13, 1994, 108 Stat. 2142, 2147.)Historical and Revision NotesBased on sections 594, 656a, 952, 981, 1093, 1124, 1243, and 1314 of title 12, U.S.C., 1940 ed., Banks and Banking (Dec. 23, 1913, ch. 6, §22, fourth sentence of first paragraph, and third sentence of second paragraph, 38 Stat. 272; July 17, 1916, ch. 245, §§28, 31 [third sentence of first paragraph], 39 Stat. 381, 383; July 17, 1916, ch. 245, §§208(c), 211(d), second sentence, as added Mar. 4, 1923, ch. 252, §2, 42 Stat. 1459, 1460; Sept. 26, 1918, ch. 177, §5 [""22(b)""] 40 Stat. 970; Mar. 4, 1923, ch. 252, title II, §§209(c), 216(d) [second sentence], 42 Stat. 1468, 1472; Ex. Ord. No. 6084, Mar. 27, 1933; June 16, 1933, ch. 98, §80(a), 48 Stat. 273; Aug. 23, 1935, ch. 614, §326(b), 49 Stat. 716; Aug. 19, 1937, ch. 704, §20, 50 Stat. 710).Section 594 of title 12, U.S.C., 1940 ed., Banks and Banking, first paragraph, related to national-bank examiners and Federal Deposit Insurance Corporation examiners, and provided punishment for several offenses including the offense of performing services, for compensation, other than their regular duties. Section 656a of said title 12 is authority for the designation ""farm credit examiner"" included in this section, and section 1093 of said title authorizes farm credit examiners to conduct examinations in connection with contemplated transactions of Federal intermediate credit banks, to which section 1124 of said title relates.Sections 981 and 1124 of title 12, U.S.C., 1940 ed., Banks and Banking, which relate to farm credit examiners, and section 1314 of said title, which relates to National Agricultural Credit Corporation examiners, all prohibit the performance of services, for compensation, other than regular duties. They do not specifically provide punishment for violation of such prohibition, but the provisions of said section 594 of said title, relating to national-bank examiners and Federal Deposit Insurance Corporation examiners, which does provide punishment for the same offense, are extended to the former two types of examiners by sections 952 and 1243 thereof.The remaining provisions of sections 594, 981, 1124, and 1314 of title 12, U.S.C., 1940 ed., Banks and Banking, relating to unlawful disclosure of the names of borrowers or the collateral for loans, false statements in applications for loans, overvaluation of securities, and acceptance of loans or gratuities, were separated and transferred according to subject matter to sections 218, 1014, 1906–1908 of this title, where, insofar as possible, they were consolidated with similar provisions from other sections.Minor changes were made in phraseology.Editorial NotesAmendments1994-Pub. L. 103–322, §330016(1)(K), substituted ""fined under this title"" for ""fined not more than $5,000"".Pub. L. 103–322, §330004(12), inserted ""or"" before ""farm credit examiner"" and struck out ""or an examiner of National Agricultural Credit Corporations,"" before ""performs any other service"".","Amendments1994-Pub. L. 103–322, §330016(1)(K), substituted ""fined under this title"" for ""fined not more than $5,000"".Pub. L. 103–322, §330004(12), inserted ""or"" before ""farm credit examiner"" and struck out ""or an examiner of National Agricultural Credit Corporations,"" before ""performs any other service""."
1910. Nepotism in appointment of receiver or trustee,https://uscode.house.gov/view.xhtml?req=granuleid:USC-prelim-title18-section1910&num=0&edition=prelim,"Whoever, being a judge of any court of the United States, appoints as receiver, or trustee, any person related to such judge by consanguinity, or affinity, within the fourth degree-Shall be fined under this title or imprisoned not more than five years, or both.(June 25, 1948, ch. 645, 62 Stat. 792; Pub. L. 103–322, title XXXIII, §330016(1)(L), Sept. 13, 1994, 108 Stat. 2147.)Historical and Revision NotesBased on section 531 of title 28, U.S.C., 1940 ed., Judicial Code and Judiciary (Aug. 25, 1937, ch. 777, 50 Stat. 810).Minor changes were made in phraseology.Editorial NotesAmendments1994-Pub. L. 103–322 substituted ""fined under this title"" for ""fined not more than $10,000"" in last par.","Amendments1994-Pub. L. 103–322 substituted ""fined under this title"" for ""fined not more than $10,000"" in last par."
1911. Receiver mismanaging property,https://uscode.house.gov/view.xhtml?req=granuleid:USC-prelim-title18-section1911&num=0&edition=prelim,"Whoever, being a receiver, trustee, or manager in possession of any property in any cause pending in any court of the United States, willfully fails to manage and operate such property according to the requirements of the valid laws of the State in which such property shall be situated, in the same manner that the owner or possessor thereof would be bound to do if in possession thereof, shall be fined under this title or imprisoned not more than one year, or both.(June 25, 1948, ch. 645, 62 Stat. 792; Pub. L. 103–322, title XXXIII, §330016(1)(J), Sept. 13, 1994, 108 Stat. 2147.)Historical and Revision NotesBased upon section 124 of title 28, U.S.C., 1940 ed., Judicial Code and Judiciary (Mar. 3, 1911, ch. 231, §65, 36 Stat. 1104).Word ""trustee"" was inserted after ""receiver"" so as to make it clear that persons holding such office are included in the enumeration of court officers who are subject to the provisions of this section.Changes were made in phraseology and arrangement, but without change of substance or meaning.Other provisions of section 124 of title 28, U.S.C., 1940 ed., were retained in that title.Editorial NotesAmendments1994-Pub. L. 103–322 substituted ""fined under this title"" for ""fined not more than $3,000"".","Amendments1994-Pub. L. 103–322 substituted ""fined under this title"" for ""fined not more than $3,000""."
1912. Unauthorized fees for inspection of vessels,https://uscode.house.gov/view.xhtml?req=granuleid:USC-prelim-title18-section1912&num=0&edition=prelim,"Whoever, being an officer, employee, or agent of the United States or any agency thereof, engaged in inspection of vessels, upon any pretense, receives any fee or reward for his services, except what is allowed to him by law, shall be fined under this title or imprisoned not more than six months, or both; and shall forfeit his office.(June 25, 1948, ch. 645, 62 Stat. 792; Pub. L. 103–322, title XXXIII, §330016(1)(G), Sept. 13, 1994, 108 Stat. 2147.)Historical and Revision NotesBased on title 18, U.S.C., 1940 ed., §196 (Mar. 4, 1909, ch. 321, §107, 35 Stat. 1107).The phrase ""officer or employee of the United States or any agency thereof"" was substituted for the phrase ""inspector of steamboats"" in view of 1946 Reorganization Plan No. 3, eff. July 16, 1946, 11 F.R. 7875, 60 Stat. 1097, abolishing inspectors and transferring their functions to the Coast Guard.Minor changes were made in phraseology.Editorial NotesAmendments1994-Pub. L. 103–322 substituted ""fined under this title"" for ""fined not more than $500"".","Amendments1994-Pub. L. 103–322 substituted ""fined under this title"" for ""fined not more than $500""."
