Section,Url,Content,Metadata
101. —Front Matter,https://uscode.house.gov/view.xhtml?req=granuleid:USC-prelim-title18-chapter101-front&num=0&edition=prelim,"18 USC Ch. 101: Front Matter            Result 1 of 1                                      Current2018 Ed. and Supplement V (1/3/2024)2018 Ed. and Supplement IV (1/5/2023)2018 Ed. and Supplement III (1/3/2022)2018 Ed. and Supplement II (1/13/2021)2018 Ed. and Supplement I (1/24/2020)2018 Main Ed. (1/14/2019)2012 Ed. and Supplement V (1/12/2018)2012 Ed. and Supplement IV (1/6/2017)2012 Ed. and Supplement III (1/3/2016)2012 Ed. and Supplement II (1/5/2015)2012 Ed. and Supplement I (1/16/2014)2012 Main Ed. (1/15/2013)2006 Ed. and Supplement V (1/3/2012)2006 Ed. and Supplement IV (1/7/2011)2006 Ed. and Supplement III (2/1/2010)2006 Ed. and Supplement II (1/5/2009)2006 Ed. and Supplement I (1/8/2008)2006 Main Ed. (1/3/2007)2000 Ed. and Supplement V (1/2/2006)2000 Ed. and Supplement IV (1/3/2005)2000 Ed. and Supplement III (1/19/2004)2000 Ed. and Supplement II (1/6/2003)2000 Ed. and Supplement I (1/22/2002)2000 Main Ed. (1/2/2001)1994 Ed. and Supplement V (1/23/2000)1994 Ed. and Supplement IV (1/5/1999)1994 Ed. and Supplement III (1/26/1998)1994 Ed. and Supplement II (1/6/1997)1994 Ed. and Supplement I (1/16/1996)1994 Main Ed. (1/4/1995)                         Back to Original Document << Previous                                 TITLE 18 / PART I / CHAPTER 101 / Front Matter                                 Next >>[Print]                                  [Print selection][OLRC Home]Help 18 USC Ch. 101: Front MatterFrom Title 18-CRIMES AND CRIMINAL PROCEDUREPART I-CRIMESCHAPTER 101-RECORDS AND REPORTSCHAPTER 101-RECORDS AND REPORTSSec.2071.Concealment, removal, or mutilation generally.2072.False crop reports.2073.False entries and reports of moneys or securities.2074.False weather reports.2075.Officer failing to make returns or reports.2076.Clerk of United States District Court.",
"2071. Concealment, removal, or mutilation generally",https://uscode.house.gov/view.xhtml?req=granuleid:USC-prelim-title18-section2071&num=0&edition=prelim,"(a) Whoever willfully and unlawfully conceals, removes, mutilates, obliterates, or destroys, or attempts to do so, or, with intent to do so takes and carries away any record, proceeding, map, book, paper, document, or other thing, filed or deposited with any clerk or officer of any court of the United States, or in any public office, or with any judicial or public officer of the United States, shall be fined under this title or imprisoned not more than three years, or both.(b) Whoever, having the custody of any such record, proceeding, map, book, document, paper, or other thing, willfully and unlawfully conceals, removes, mutilates, obliterates, falsifies, or destroys the same, shall be fined under this title or imprisoned not more than three years, or both; and shall forfeit his office and be disqualified from holding any office under the United States. As used in this subsection, the term ""office"" does not include the office held by any person as a retired officer of the Armed Forces of the United States.(June 25, 1948, ch. 645, 62 Stat. 795; Pub. L. 101–510, div. A, title V, §552(a), Nov. 5, 1990, 104 Stat. 1566; Pub. L. 103–322, title XXXIII, §330016(1)(I), Sept. 13, 1994, 108 Stat. 2147.)Historical and Revision NotesBased on title 18, U.S.C., 1940 ed., §§234, 235 (Mar. 4, 1909, ch. 321, §§128, 129, 35 Stat. 1111, 1112).Section consolidates sections 234 and 235 of title 18, U.S.C., 1940 ed.Reference in subsection (a) to intent to steal was omitted as covered by section 641 of this title.Minor changes were made in phraseology.Editorial NotesAmendments1994-Pub. L. 103–322 substituted ""fined under this title"" for ""fined not more than $2,000"" in subsecs. (a) and (b).1990-Subsec. (b). Pub. L. 101–510 inserted at end ""As used in this subsection, the term 'office' does not include the office held by any person as a retired officer of the Armed Forces of the United States.""Statutory Notes and Related SubsidiariesEffective Date of 1990 AmendmentPub. L. 101–510, div. A, title V, §552(b), Nov. 5, 1990, 104 Stat. 1567, provided that: ""The amendment made by subsection (a) [amending this section] shall be effective as of January 1, 1989.""","Amendments1994-Pub. L. 103–322 substituted ""fined under this title"" for ""fined not more than $2,000"" in subsecs. (a) and (b).1990-Subsec. (b). Pub. L. 101–510 inserted at end ""As used in this subsection, the term 'office' does not include the office held by any person as a retired officer of the Armed Forces of the United States.""Statutory Notes and Related SubsidiariesEffective Date of 1990 AmendmentPub. L. 101–510, div. A, title V, §552(b), Nov. 5, 1990, 104 Stat. 1567, provided that: ""The amendment made by subsection (a) [amending this section] shall be effective as of January 1, 1989."""
2072. False crop reports,https://uscode.house.gov/view.xhtml?req=granuleid:USC-prelim-title18-section2072&num=0&edition=prelim,"Whoever, being an officer or employee of the United States or any of its agencies, whose duties require the compilation or report of statistics or information relating to the products of the soil, knowingly compiles for issuance, or issues, any false statistics or information as a report of the United States or any of its agencies, shall be fined under this title or imprisoned not more than five years, or both.(June 25, 1948, ch. 645, 62 Stat. 795; Pub. L. 103–322, title XXXIII, §330016(1)(K), Sept. 13, 1994, 108 Stat. 2147.)Historical and Revision NotesBased on title 18, U.S.C., 1940 ed., §215 (Mar. 4, 1909, ch. 321, §124, 35 Stat. 1111).Words ""or any of its agencies"" were inserted after ""United States"" so as to eliminate any possible ambiguity as to scope of section. (See definitive section 6 of this title.)Minor changes were made in phraseology.Editorial NotesAmendments1994-Pub. L. 103–322 substituted ""fined under this title"" for ""fined not more than $5,000"".","Amendments1994-Pub. L. 103–322 substituted ""fined under this title"" for ""fined not more than $5,000""."
2073. False entries and reports of moneys or securities,https://uscode.house.gov/view.xhtml?req=granuleid:USC-prelim-title18-section2073&num=0&edition=prelim,"Whoever, being an officer, clerk, agent, or other employee of the United States or any of its agencies, charged with the duty of keeping accounts or records of any kind, with intent to deceive, mislead, injure, or defraud, makes in any such account or record any false or fictitious entry or record of any matter relating to or connected with his duties; orWhoever, being an officer, clerk, agent, or other employee of the United States or any of its agencies, charged with the duty of receiving, holding, or paying over moneys or securities to, for, or on behalf of the United States, or of receiving or holding in trust for any person any moneys or securities, with like intent, makes a false report of such moneys or securities-Shall be fined under this title or imprisoned not more than ten years, or both.(June 25, 1948, ch. 645, 62 Stat. 795; Pub. L. 103–322, title XXXIII, §330016(1)(K), Sept. 13, 1994, 108 Stat. 2147.)Historical and Revision NotesBased on title 18, U.S.C., 1940 ed., §189 (Mar. 4, 1911, ch. 270, 36 Stat. 1355).Words ""or any of its agencies"" were inserted after ""United States"" so as to eliminate any possible ambiguity as to scope of section. (See definitive section 6 of this title.)References to persons aiding and abetting were omitted. Such persons are principals under section 2 of this title.Minor verbal changes were made.Editorial NotesAmendments1994-Pub. L. 103–322 substituted ""fined under this title"" for ""fined not more than $5,000"" in last par.","Amendments1994-Pub. L. 103–322 substituted ""fined under this title"" for ""fined not more than $5,000"" in last par."
2074. False weather reports,https://uscode.house.gov/view.xhtml?req=granuleid:USC-prelim-title18-section2074&num=0&edition=prelim,"Whoever knowingly issues or publishes any counterfeit weather forecast or warning of weather conditions falsely representing such forecast or warning to have been issued or published by the Weather Bureau, United States Signal Service, or other branch of the Government service, shall be fined under this title or imprisoned not more than ninety days, or both.(June 25, 1948, ch. 645, 62 Stat. 795; Pub. L. 103–322, title XXXIII, §330016(1)(G), Sept. 13, 1994, 108 Stat. 2147.)Historical and Revision NotesBased on title 18, U.S.C., 1940 ed., §117 (Mar. 4, 1909, ch. 321, §61, 35 Stat. 1100).Minor verbal changes were made.Editorial NotesReferences in TextThe United States Signal Service, referred to in text, is now the Signal Corps which is a branch of the Army, see section 3063 of Title 10, Armed Forces.Amendments1994-Pub. L. 103–322 substituted ""fined under this title"" for ""fined not more than $500"".Executive DocumentsTransfer of FunctionsWeather Bureau of Department of Commerce consolidated with Coast and Geodetic Survey to form a new agency in Department of Commerce to be known as Environmental Science Services Administration by Reorg. Plan No. 2 of 1965, eff. July 13, 1965, 30 F.R. 8819, 79 Stat. 1318, set out in the Appendix to Title 5, Government Organization and Employees. All functions of Bureau transferred to Secretary of Commerce by the Plan.Environmental Science Services Administration abolished by Reorg. Plan No. 4 of 1970, eff. Oct. 3, 1970, 35 F.R. 15627, 84 Stat. 2090, set out in the Appendix to Title 5, Government Organization and Employees, which created National Oceanic and Atmospheric Administration in Department of Commerce. By Department Organization Order 25–5A, republished 39 F.R. 27486, Secretary of Commerce delegated to NOAA his functions relating to Weather Bureau. By order of Acting Associate Administrator of NOAA, the organization name of Weather Bureau was changed to National Weather Service. For further details, see Codification note under section 311 of Title 15, Commerce and Trade.","References in TextThe United States Signal Service, referred to in text, is now the Signal Corps which is a branch of the Army, see section 3063 of Title 10, Armed Forces.Amendments1994-Pub. L. 103–322 substituted ""fined under this title"" for ""fined not more than $500"".Executive DocumentsTransfer of FunctionsWeather Bureau of Department of Commerce consolidated with Coast and Geodetic Survey to form a new agency in Department of Commerce to be known as Environmental Science Services Administration by Reorg. Plan No. 2 of 1965, eff. July 13, 1965, 30 F.R. 8819, 79 Stat. 1318, set out in the Appendix to Title 5, Government Organization and Employees. All functions of Bureau transferred to Secretary of Commerce by the Plan.Environmental Science Services Administration abolished by Reorg. Plan No. 4 of 1970, eff. Oct. 3, 1970, 35 F.R. 15627, 84 Stat. 2090, set out in the Appendix to Title 5, Government Organization and Employees, which created National Oceanic and Atmospheric Administration in Department of Commerce. By Department Organization Order 25–5A, republished 39 F.R. 27486, Secretary of Commerce delegated to NOAA his functions relating to Weather Bureau. By order of Acting Associate Administrator of NOAA, the organization name of Weather Bureau was changed to National Weather Service. For further details, see Codification note under section 311 of Title 15, Commerce and Trade."
2075. Officer failing to make returns or reports,https://uscode.house.gov/view.xhtml?req=granuleid:USC-prelim-title18-section2075&num=0&edition=prelim,"Every officer who neglects or refuses to make any return or report which he is required to make at stated times by any Act of Congress or regulation of the Department of the Treasury, other than his accounts, within the time prescribed by such Act or regulation, shall be fined under this title.(June 25, 1948, ch. 645, 62 Stat. 796; Pub. L. 107–273, div. B, title IV, §4002(d)(1)(C)(ii), Nov. 2, 2002, 116 Stat. 1809.)Historical and Revision NotesBased on title 18, U.S.C., 1940 ed., §188, (Mar. 4, 1909, ch. 321, §101, 35 Stat. 1107).Editorial NotesAmendments2002-Pub. L. 107–273 substituted ""under this title"" for ""not more than $1,000"".","Amendments2002-Pub. L. 107–273 substituted ""under this title"" for ""not more than $1,000""."
2076. Clerk of United States District Court,https://uscode.house.gov/view.xhtml?req=granuleid:USC-prelim-title18-section2076&num=0&edition=prelim,"Whoever, being a clerk of a district court of the United States, willfully refuses or neglects to make or forward any report, certificate, statement, or document as required by law, shall be fined under this title or imprisoned not more than one year, or both.(June 25, 1948, ch. 645, 62 Stat. 796; Pub. L. 104–294, title VI, §601(a)(11), Oct. 11, 1996, 110 Stat. 3498.)Historical and Revision NotesBased on section 522 of title 28, U.S.C., 1940 ed., Judicial Code and Judiciary (Feb. 22, 1875, ch. 95, §6, 18 Stat. 334).The reference to the offense as a misdemeanor was omitted as unnecessary in view of the definition of ""misdemeanor"" in section 1 of this title.The last sentence providing that conviction should not be a condition precedent to removal from office was omitted as unnecessary.Minor changes were made in phraseology.Editorial NotesAmendments1996-Pub. L. 104–294 substituted ""fined under this title or imprisoned not more than one year, or both"" for ""fined not more than $1,000 or imprisoned not more than one year"" before period at end.","Amendments1996-Pub. L. 104–294 substituted ""fined under this title or imprisoned not more than one year, or both"" for ""fined not more than $1,000 or imprisoned not more than one year"" before period at end."
